ID,Data,Classification
1642889498890588161,"Kindergarten pre-registration is now open! If you have a child who will be enrolling in Kindergarten next year, please visit https://t.co/Vtcq4KM8It for more information. https://t.co/3Kot7dA3oi",FALSE
1642889492007723010,"@ChuckCallesto THE ALIENS DONT WANNA VISIT, WE DONT PROVIDE THEM A SINGLE BIT OF VALUE",FALSE
1642889490954944513,#NowPlaying On #HotxxMagOnlineRadio Boogiebaby x Lisa Lise - Never Chase Visit: https://t.co/j9qfBFfaAx Submit your music for rotation! Email: HotxxMagOnlineRadio@gmail.com #OnlineRadioStation #Music #Radio #IndieArtistBoogiebaby x Lisa Lise https://t.co/SPZX3tpfWi,FALSE
1642889490908758016,"@PCMckenna @TheNYRA @LeroyComrie @ItisMichaelle @timesunion Pouring money down a dark hole. Hardly anyone goes to Belmont and after a brief curiosity visit, new Belmont will be kinda empty just like now",FALSE
1642889486190411779,Total Knee Replacement For more information visit the website https://t.co/TabXbLSq5i E-Mail us at info@drgovindjoshi.com or call @ 9650141752 Dr Govind Vallabh Joshi #healthcare #health #knee #DrGovindJoshi #orthopedics #pain #painrelief #kneepain #Kneepainproblems https://t.co/m6TBT9SFbt,FALSE
1642889482134331393,@CounsellingSam Don't worry Sam. The CEO of OFCOM will soon get a visit from a gentleman with a brown envelope full of crisp £50 notes. Investigation closed. Nothing to see here.,FALSE
1642889480985100292,I spread bark butter on the trees to see who comes to visit. First friends to stop by this morning were a crow and squirrel!,FALSE
1642889478879715328,"#GodNightMonday Visit ⤵️⤵️ Download our official app ""Sant Rampal Ji Maharaj"" In Playstore से करें। https://t.co/eZve0wbzre",FALSE
1642889475914346498,"Modern House Design! Here's a Floor Plan which provides a clean and simple visual overview of the house for a free site visit, call us at +919885353531, +918823882339 #floorplans #architecturaldesigns #3dplans #building #constitution #contractor #builder #besthyderabadbuilders https://t.co/9Fh1qKSK8K",FALSE
1642889472080596995,"#HouseoftheWeek - 5 Oak Valley Lane, Purchas. NY. Stunning 6-bed, 7.2-bath cedar shingle home in Purchase inspired by renowned architect Robert A. M. Stern. If you are considering selling or buying a home, please contact me at 914.806.6868 or visit https://t.co/S9niDx96CK https://t.co/OUbQjwHsMr",FALSE
1642889466598547456,@MeghansMole Prince Harry ‘stayed at Frogmore Cottage’ during surprise UK visit (https://t.co/IrWJwh86UQ),TRUE
1642889463935148033,Arnold Town Res team boss Ashley Marshall could not hide hide his disappointment as his title chasing side came unstuck losing 2-3 at Bull Farm on Sat with a couple of crucial decisions going against the Eagles -Sat Apr 8th sees Basford U21s visit EV in County Cup action ko 3pm,FALSE
1642889462702014466,"@apmassaro3 Glad, to meet you Paul in Mykolaiv. Waiting for your next visit, and for future cooperation!🇺🇦❤️🇺🇲",FALSE
1642889462450384896,Celebrate Sport in Clarington from April 21 to 23! 🏒🏀🏈⚽️⚾️ ✅ Swim and skate for free all weekend ✅ Try the Fitness Training Centre (18+) on April 21 ✅ Visit the Celebrate Sport in Clarington Showcase on April 22 Learn more at https://t.co/yzEf9jYkVa. https://t.co/miNiTvpo6o,FALSE
1642889462421102594,Summer camp registration is finally open! Visit our website at https://t.co/MLX9MseOVt to reserve a spot today!! 😎 ☀️ https://t.co/N9Lt0NXkA1,FALSE
1642889460995039234,❤️ Happening all week! Come and visit the classrooms. /❤️ ¡Pasando toda la semana! Ven y visita los salones. https://t.co/G1INFpK3PL,FALSE
1642889460617543680,"Visit our official website at https://t.co/HnxvzIA5s5 to learn all about us, and click on the top right corner to Connect wallet. Check if you're eligible for the airdrop! (You need some eth to pay for gas) 2/3 🔨🔀📋✔️",FALSE
1642889458126036996,The campus visit tour continues for a visit to Mt. Pleasant. #FireUpChips,FALSE
1642889446675587072,Visit our BHO Hardware eBay Store Today ➡️ https://t.co/l7Oz12eL3r 👀 #BHO #BHOHardware #BHOEquipment #BHOExtraction https://t.co/cqBcNyq7Xd,FALSE
1642889439377498115,Come Visit One Of The Prettiest Small Towns In Georgia https://t.co/VMM3AK0bkB,FALSE
1642889438928728064,"New week, new career? For more information on these positions and to apply, please visit https://t.co/HKwzk3jzHR #career #jobs #jobsavailable #applynow https://t.co/DkOZMveORI",FALSE
1642889438685728768,"Slightly different opening times for the libraries of the University of Lincoln over the holiday break, please check these out before you visit! You can always contact us online or pop in to visit if you have any questions! Happy Holidays! 🥚🐥🎉🌾🌷 https://t.co/YAFcjbvIeG",FALSE
1642889438618435584,Follow us for more social media marketing tips. Visit https://t.co/sGaWwJ4b9Y to get more free useful resources for your business. #digitalmarketing #deversityconsult #socialmediamarketing #digitalmarketingagency #smm #socialmediamanagement #emailmarketing #websitecreation https://t.co/qOuYRIIwbF,FALSE
1642889438127636481,Happy Monday! “Man cannot discover new oceans unless he has the courage to lose sight of the shore.” -Andre Gide Find the nearest Labor Solutions office to you. Visit us at https://t.co/Gl4QFfqdeH #laborsolutions #MotivationalMonday #staffingindustry #QuoteOfTheWeek https://t.co/anWTfEqvt7,FALSE
1642889434898022400,"In 2032 the West Midlands will: Be celebrated for the contribution which people and communities make to local, national, and international culture. We will have developed and strengthened our unique global links and be a region people will want to live in and visit. https://t.co/ryXWIzb7zA",FALSE
1642889434499522565,@Gondalism Heard its worth the hype in taste. Do share your feedback if you pay a visit.,FALSE
1642889431588782081,"The Highland Park Food Pantry Distribution will be distributing this month on the following dates at the Highland Park Community Center, 220 South 6th Ave: April 13, 15, 27 &amp; 29 For a full schedule, please visit https://t.co/vJ7VKbVtbC https://t.co/TZquAKLf9F",FALSE
1642889424328425473,@D_Supriya It’s a wonderful place to visit! I’d love to go back!,FALSE
1642889422218616833,"In partnership with @UMSL_ISP, we will host Retired Navy Captain Henry Stephenson. Captain Stephenson will discuss the current situation within Iran. Visit the link below to reserve your spot or learn more! https://t.co/FMgp3F3JwD https://t.co/t6dScH0own",TRUE
1642889421078040577,#MondayMotivation क्या आप जानते हो कि भस्मासुर का असली नाम भस्मागिरी था लेकिन उसका नाम भस्मासुर कैसे पड़ गया ?? अधिक जानकारी के लिए :- 👇👇👇 Satlok Ashram Youtube चैनल पर visit करें। https://t.co/fhIAR1EY4k,FALSE
1642889418167160833,"If you have a need to visit local healthcare facilities, note that masking requirements differ depending on your needs and which medical center you are at. https://t.co/BW284zsaTI",FALSE
1642889411116384257,"@Colbywinters This is Angkor Wat, in Cambodia. It is said to be the world's largest religious structure. I want to see it for its historical significance. I don't care about the religious part. I don't want to go because it's in Cambodia. Not a place I really want to visit. https://t.co/SRTivJO48G",FALSE
1642889409790967809,"#DavoAlbums are available for 70 countries/territories Premium stamp albums available in Luxe (with mounts affixed to the pages) or in Standard Luxe (without mounts) Visit the shop, we ship worldwide! https://t.co/YcY8S8HPw2 #philately #Stampalbums https://t.co/UTKN57uflt",FALSE
1642889408809410562,"Kindergarten pre-registration is now open! If you have a child who will be enrolling in Kindergarten next year, please visit https://t.co/mU6p17kXGH for more information. https://t.co/h19t2RmZcr",FALSE
1642889399468793856,@MeghansMole Prince Harry ‘stayed at Frogmore Cottage’ during surprise UK visit (https://t.co/IrWJwh86UQ),TRUE
1642889397270986752,@saintjavelin I would love to visit all parts of Ukraine 🇺🇦.,FALSE
1642889392669835265,"@DanielaNadj I love German food, especially ""gut bürgerliche Küche"" but imho Spätzle are way overrated, just mushy pasta. Much prefer proper Italian pasta al dente. (I may no longer be allowed to visit family in Schwaben after this comment 😂)",FALSE
1642889388051902464,"@danhawkphoto Awesome people, culture, classic cars and trip. I hope to visit again one day and travel more inland and other regions beyond the ones I visited in 2016. 🍻",FALSE
1642889386718011393,"@ImThaTPiNNeY @GavynnnOrig @LuciferCrafts @JAMALIGLE @caseyjflores @AndrewDobrow Russia use to be part of the Nuclear Treaty that Reagan put together. The last time Biden went to visit Zelensky, Russia pulled out of that deal. Plus we have all these terrorist here who came over the southern boarder the last 2 yrs. Maps made of “obvious” US targets is scary!",TRUE
1642889373610917890,@GreenishFrogg Whenever you desire and come visit,FALSE
1642889372633817088,The India Bond Info portal from NSDL provides complete information about Indian Corporate Bonds and Debentures. Visit :https://t.co/wb4zUTbcA8 #IndiaBondInfo #NSDL #CorporateBonds #Debentures #FinancialMarket #IndianEconomy #SurakshitSamajhdarAtmanirbharNiveshak https://t.co/48QYyKcJmF,FALSE
1642889369202700288,"He needs to visit me and my neighbours. I know so many people whose first question to any candidate of any sort foolish enough to knock on our doors will be ""what is a woman?""",FALSE
1642889364492492801,"SPRING has arrived 🌸 It is so nice to be able to see some sun - let's enjoy it whilst it lasts! ☀️ You can discover things to do and places to visit across the Braintree district over at https://t.co/7veBg6PpmM 📍 Weaver's Park, Braintree https://t.co/zS6ndL6xOL",FALSE
1642889356074704896,"May isang uh lah low na naman ang nagkalat. Boi, alam mo ba ang mga salitang official visit at state visit? Kung hindi, alam mo na kung bakit natalo ang ina mong idol mo😀🤣😅nasobtahan sa talino pero di pa rin maipanalo sng ina nila😅🤣😀 https://t.co/5teIhIrZaF",FALSE
1642889351427137538,A very very good place to visit…,FALSE
1642889347295858688,"Give in to the temptations. For T&amp;C, visit: https://t.co/vvSAemyBo5 #CreditCard #PNBoffers #Offers #Electronic #TimeToChange https://t.co/WsQB63ACHt",FALSE
1642889344204836864,"@RamChanamalla Hi Ram, we understand your concern. Rest assured, our engineer will visit soon. We appreciate your patience – Karuna",FALSE
1642889342082248705,"@BasedWarszawa Golden mine for a travel agency : tourist road especially for Poles. ""Visit all India's Kurwy"".",FALSE
1642889339423137795,"That's right, packer friends. We got Culver's in San Antonio. Come visit us.",FALSE
1642889325095317507,"@beyondliberalbs Hello, we generally allow users to stand behind what they write. However, if you find a review that you believe violates Yelp's guidelines, we invite you to report it so that our moderators can take a look. For instructions on how to report a review, visit https://t.co/slE23Ai1g4",FALSE
1642889324869083136,"#GodNightMonday Visit santrampalji Maharaj YouTube channel Satlok Ashram, Watch MH1 TV2:00pm,📺 https://t.co/JKNOhvjfXI",FALSE
1642889315104456705,"@amani90___ I want to visit, such a beautiful ancient Holy Land. God bless Bilad al-Sham.",FALSE
1642889312806006791,"""Vice President Kamala Harris will visit an expanding solar panel manufacturing plant in northwest Georgia as part of a White House effort to talk up President Joe Biden’s economic agenda."" https://t.co/YYGcDbwnS1",TRUE
1642889312445386752,"@ziggy6769 my friend came for a visit from London,England but she is originally fom Dublin, Ireland. We were talking and she thought well you're Scottish meaning me and was surprised that I said I' a Brit,Scot,Glaswegian...in that order. We laughed.",FALSE
1642889309895159811,"𝐅𝐞𝐚𝐭𝐮𝐫𝐞𝐝 尺𝐞𝐬𝐭𝐚𝐮𝐫𝐚𝐧𝐭 𝐨𝐟 𝐭𝐡𝐞 𝐖𝐞𝐞𝐤: Maxwell's Pizza, 2759 Maysville Pike, 740.617.1701 offers delicious artisan pizza, wings, salads, wraps and desserts! Order lunch or dinner for pick-up, delivery or eat outside on their patio. https://t.co/IHk27NAAwl https://t.co/IhdcoZwlNz",FALSE
1642889306351050755,A perfect place for those looking for elegance and excellent services- GRAVITY HOTEL Kindly visit our website https://t.co/HXAJMtLSXj for more information. #gravityhotels #excellence #newowerri https://t.co/OViV0LrzQd,FALSE
1642889301464698880,"@JustStarman Hi, Joseph. This is an Apple Card Specialist at Goldman Sachs. Your credit limit is based on multiple factors. For more information, please visit https://t.co/qf2bXDicab, or you may reach out to us through your Wallet. Our team is available 24/7 to assist.",FALSE
1642889299791163394,@kinsellawarren @PatricianGrill @thepilot_j0 Prior to your painting I had not heard of this Grill but I plan on going when I visit Toronto this summer.,FALSE
1642889287631790082,"TMA's April Calendar is JAM-packed with exciting events! Make sure you plan to join us at one of TMA's many upcoming events! Can't wait to connect! To get details, visit: https://t.co/SFYEiHbISP #TMA23 #JoinUs #Events #JamPacked #Exciting #SeeYouThere https://t.co/Qh6QtCxUW9",FALSE
1642889287229120512,"@saytoazeem Hey Azeem, thanks for your tweets and sorry to hear of the issues faced and this poor experience. Can you please visit our service status page here https://t.co/q6IThSshUh and check your post code for reported area faults? If not, please run our checks https://t.co/7JnMozShyX ^AG",FALSE
1642889281730387969,Imagine a few years down the line when the bronze is starting to corrode and the local kids have damaged it. They're gonna break that rusty Cage and run. New statue plan for Carlton Hill to commemorate visit of Hollywood legend https://t.co/9l60busFm0 via @@gedlingeye,FALSE
1642889277112565761,"#NowPlaying on Classic Rock California: ""King Of Pain"" by The Police from the Album: Synchronicity (Remastered 2003). Visit: https://t.co/GSWNeCcxDA https://t.co/s6YCCimY41",FALSE
1642889270166962177,#MyTradingPet #OIL - BUY at 80.604: -Near strong support at 81.050 (d1) Visit https://t.co/t0azzSpeGX for more! *trading involves risk #forexsignals #forex #trading #Daytrading #AI https://t.co/kdkKq939Ov,FALSE
1642889269298757637,@Saffron_nik @asadowaisi Here's your screenshot. ⚡ Want to automatically post your tweets on Instagram? Visit https://t.co/6fIpjtKrSz. https://t.co/dKFHcl2OQF,FALSE
1642889266106597377,"@Steve_Laws_ Sikhs work hard, don't try to force their religion down other people's throats, integrate more into British society, don't demand special treatment. You or anyone can visit one of their temple's and will always be offered food and welcomed.",FALSE
1642889250814279680,@waris_oloyede @Yemi__Ajayi U don Mc Oluoma where he don visit for east,FALSE
1642889248582905859,"What's amazing about these ""garads"" is they always capturing them eating, chilling, living in luxury..I have never seen them visit 50k+ refugees from laascaanood living in dire situasion...Feel sorry for the ppl who allowed such lowlifes who don't care about them,to lead them",FALSE
1642889243407073280,"P3K sighting at a Junior Day visit! Keep going, keep grinding @benhoilandkicks 📶 https://t.co/lPEpiYw4oJ",FALSE
1642889240932483073,@ShareenSingh8 Well they never had the gumption to stand up for the Dalai Lama being allowed to visit either.,FALSE
1642889239619678208,"We're looking for an enthusiastic Box Office Assistant to join our friendly and committed team. If you would like to apply, please visit: https://t.co/O6ZSTFhDup for full details, feel free to share with anyone who may be interested! @TrinityLaban @OperaBH https://t.co/R4cX3LuUAa",FALSE
1642889238197817344,@Jason22330865 @DLerch22 @FoxNews Maybe you should visit Europe or at least do some reading. Here some facts for you about Europe....: - More healthier - More likely to get an education - Higher quality of living - Less likely to be the victim of a violent crime. - Lower murder rate,FALSE
1642889238105423873,@yangadentaI I go visit dentist but no be you.,FALSE
1642889234968133636,"Summary… The speaker thinks that people spend a lot of money to travel out of Ghana, but they could use that money to do other things in Ghana. They prefer to visit other countries rather than move abroad permanently because life abroad is not as good as people make it seem.",FALSE
1642889232933945344,"“You are an ambassador. Your interlocutor here is the president,” Erdogan said during a visit to a nationalist youth group. “How will you ask for a meeting with the president from now on?” Erdogan’s door “has been closed to him,” the president added",TRUE
1642889227971985409,Justices of HC visit Mubarak Mandi complex over complaint filed by Dogra Sadar Sabha for slow pace of work Full Video: https://t.co/eDrl1Lo1im #JammuAndKashmir https://t.co/EFtOTCoXzA,TRUE
1642889227019997184,"@saintjavelin Tahanroh and Helendzyk, to visit the 🇺🇦-🇬🇪 border 😎",FALSE
1642889226319454208,Indian weddings on the water on Long Island are so beautiful at Windows On The Lake. This waterfront wedding venue on Long Island has helped many happy couples join together in all different nationalities and religions. Visit https://t.co/sy0YK70STQ today for a tour! https://t.co/VwSjYw25F7,FALSE
1642889217289191425,We are looking for a Senior Lecturer in Sustainable Project Management Ac4 to join @SchoolCEPS @UniWestScotland 🗺 UWS London campus with travel ⌚ Full time (35 hrs) 🏙 permanent 💻 For full details visit https://t.co/TghGSS9NM3 Closing date 9/4/23 https://t.co/8LrJKY4gwq,FALSE
1642889216995590146,@saintjavelin I would like to visit Mykolaev or whatever it's spelled :),FALSE
1642889216232153089,@Stylo_____ Can't argue with any of those. Sadly my favourite falls outside your 10 year limit. 11/11/2000 our last visit to Bradford won in the 87min with a rare Gary Naysmith goal.,FALSE
1642889216051798021,"🚀 New project alpha alert: @incirlabs (136 followers, account created 541 days ago) Description: ""We Provide Solutions Only Possible With the Blockchain"" Visit https://t.co/v7SbDJVyKx for more alpha :)",FALSE
1642889213468196865,@LouManoti Traffic was so much heavier in Dallas this time around than it was my last visit I couldn’t really move the way I wanted.. I cut a fool on the way from the bowling alley that night tho. Lolol,FALSE
1642889213363490817,@trikansh_sharma On my must visit list.,FALSE
1642889208330358785,台湾便でこんなに行列ができるのは見たことないけど、Visit Japan Webに登録してない外国人が多いのは事実。 先頭の外国人が空港スタッフに登録方法聞いてたりすると詰まって行列できることがあります。,FALSE
1642889201514602498,"@RatanSharda55 @MaramJaikiran This was the era when an ordinary pineapple cake with silver beads from the local bakery was an aspirational item for birthdays. We would savour the thin slices of cake we received at well off ppl’s place! Visit to Palam airport was an event, a flight a dream",FALSE
1642889197496463362,Semi Automatic Strapping Machine Strapping machine Was Dispatched s ..For more info visit...https://t.co/68Y1TSYexU https://t.co/87mvZg1YyB,FALSE
1642889190248443904,@saintjavelin It’s gonna be an honor for me to visit a great country as Ukraine. It’s a long trip from Nicaragua. In my thoughts I am with all of you!!! Slava Ukraini 🇺🇦,FALSE
1642889184942739456,@Aldas001 Its not THE fans. The fans visit races.,FALSE
1642889178332426243,"But the worst part is, graveyard being in a different city, miles away, and you can’t visit them on a daily/weekly basis 😔",FALSE
1642889172280299522,"@digitalassetbuy Visit black hawk, picnic in boulder Creek, have a beaujos pizza, check out the soon to be reopened Casa Bonita, also check out the 16th street mall as far as non physical activity places go.",FALSE
1642889168350220288,There has to be institutional changes including adoption of modern technology and quota system for devotees with a cap on maximum devotees to visit in a day. Footfalls also affect the health of the shrine and the sanctum sanctorum as well. Pragmatism over emotion.,FALSE
1642889165195935747,Thanks @alexandraRdPark @AA_Estate for bringing #LittleAmal to visit our local community.,FALSE
1642889164558565378,"i keep thinking about @CarolLeonnig's report last month that ""about a week before the search, the head of the FBI's Washington Field Office insisted he didn't want to do a surprise search with a warrant, stressing they should ask Trump's permission to visit his property instead.""",FALSE
1642889161651937282,"These #cottoncurtains are perfect for your home. They come in many colors and fabrics, making it easy for you to find the right match for your space. Email: info@risalacurtains.com Visit Us Now: https://t.co/5BL5abOGBO Call Us Now: 050 678 7340 https://t.co/6JBCzfgdro",FALSE
1642889158703083523,"You can visit On Point, by Todd Gray at @LehmannMaupin Gallery, London. More information at: https://t.co/JDBjqDmr6K",FALSE
1642889157440835584,@sweetlikeshelby @thereaalkeii Me when my people come visit for the prison family day… https://t.co/7vXxcwk0z7,FALSE
1642889156635541505,"@NikkiHaley Fear not! @NikkiHaley - Private Citizen, former ex governor of South Carolina will visit the TEXAS border and help!",TRUE
1642889156270657542,"do you think when kaveh goes over to visit tighnari, cyno, &amp; collei in gandharva ville he lets mehrak hang out with karkata i think that would be really cute😭",FALSE
1642889154706161664,@willwatsonAR @GavinNewsom Come visit the insanity he's created in CA. Give me a break.,FALSE
1642889136674689025,"Rishi Sunak criticises political correctness over grooming gangs ""very, very dangerous"" to turn child sexual abuse ""into a matter of colour"" https://t.co/5acGUDzScz",FALSE
1642889136179642369,"Experience a fun run like none other. Come to the 42nd Annual Smoky Hill River Run, formally the Festival Fitness 5, on Saturday, June 10th, 2023. Visit https://t.co/tJ5b0GV7gw for online registration. Register early for a chance to win a gift card. #smokyhillriverfestival https://t.co/OukNzt2v82",FALSE
1642889135940591618,@moonstruckdew @njoyzgrl81 @VP Her husbands visit to Israel and all his big crying was disgusting to watch and highly insensitive -considering the inhumane victimization of Palestinian civilians and bid by N to take out his Supreme Court. This White House needs to grow some ethics.,TRUE
1642889135462465536,"@SenatorRennick “If no thought your mind does visit, let not your speech be too explicit” (Piet Hein). https://t.co/uehYyWFEix",FALSE
1642889131780083712,Sho plusichi Ex Taiwan pres visit to china. Coincidence w Taiwan pres and USA pres meeting? https://t.co/cT4vBgXkBX,TRUE
1642889130513252354,"#GodNightMonday Visit santrampalji Maharaj YouTube channel Satlok Ashram, ___Saint rampal Ji maharaj Watch Papcorn TV 7:30pm, 📺 https://t.co/51Ll9HyGAS",FALSE
1642889129552924675,"Our state-of-the-art technology and innovative approach to logistics make it easy to get your goods where they need to go, with no hassle or headache. +91 7230021118 | +91 755 000 2022 or visit – https://t.co/wDAf8Np3tY https://t.co/KGSsndG25C",FALSE
1642889107071463424,"Attention all nature lovers! Avelo Airlines is now flying direct from L.A. to #GlacierParkInternationalAirport. For a seamless airport experience, visit https://t.co/trKglMUcmC. #aveloairlines #montana #naturelovers #airportassist #travelgoals #meetandgreet #airportservices https://t.co/bGIKbw2Ov7",FALSE
1642889105590878209,"@Dumfukdetector And I, for one, have ZERO plans to ever visit the Shasta Fair.",FALSE
1642889102046662657,Today's Banknifty buy and sell signals with X3 system for intraday and options trading. 100% Rule based trading. No emotions and no guesswork. 3rd April 2023 chart in fast mode. For demo and other info. Visit : https://t.co/dDUUggR7kf https://t.co/2O2BUTvlz0,FALSE
1642889101958602754,Mobile Marketing can do wonders for driving brand value and demand for your products. 🌐 Visit us at https://t.co/qGdrqGNIqz 📞 Call us at +1 561-718-1148 https://t.co/Hc2rtyi8lm,FALSE
1642889097630081024,"@RTatsugaya @Crc_Spletzer Riyumi, want company? Flare and I can visit since I got back at the dorm ^^",FALSE
1642889095037820929,"🇺🇸This month’s featured Veteran: Colonel Duwayne Lundgren, United States Army, Retired (deceased). To learn more about our new program highlighting Veterans, Vote in Honor of a Veteran, please visit https://t.co/OEC4kq5GqH🇺🇸 https://t.co/seo6lbNiyZ",FALSE
1642889089593782276,"Insurance is important to anyone looking to protect their family, assets/property, and themselves from financial risk/losses. Visit our website to learn more. 👉https://t.co/X10aGgSEYp Our contact details, 👉Phone: +1(240) 549-5765 👉Email: info@ecinsurancecompany.com https://t.co/GUzD5OFNrJ",FALSE
1642889088838643712,"Moderator Kim Lewis talks with @cindysaine and @michaelontv about the top stories of the week including, U.S. Vice-President Kamala Harris’ historic and symbolic visit to Africa. Listen to Issues in the News: https://t.co/XQQtl181Ak",TRUE
1642889088276770816,Visit this midnightstarscloth #fbc #federasibantenclothing #visitbantenlocalclothing https://t.co/9NRDyPA3je,FALSE
