ID,Data,Classification
1642882248037867523,"thankfully my uncle was visiting and saved the day. otherwise I'm sure it'd have been at least a $500 bill to fix. it's not rocket science, but if you don't have the experience, you've got no clue what's right and what's wrong.",FALSE
1642882244040687617,"@tigraionline Good news for #Eritrea and #Ethiopia, but headache news for the terrorist #TPLF and their supporters. Senior commanders and officers of Eritrean Defense Forces, led by the National Security Agency, are visiting Ethiopia.",TRUE
1642882217524207617,Welcome #MidlandsMindforge formed as a JV by the 8️⃣ @InnovationMids Universities💫 A hugely exciting step in the acceleration of investment into the high-growth #MidlandsEngine #InnovationEconomy which I was delighted to be back visiting last week on 🇬🇧#UKClusterTour 1️⃣5️⃣,FALSE
1642882211270492162,You don’t have to watch from the sidelines! Get in the game with ABIS! Join the movement today by visiting https://t.co/I4rjUqybrS Let’s go!! 🔌⚡️ #weareabis #doyouseewhatwesee #advancementofblacksinsports https://t.co/fo0ERieu2s,FALSE
1642882164940238853,"Going to be in Texas visiting my family from tomorrow through next Monday! I haven't seen them since September, so i'm really looking forward to it. I'll be in Dallas through Friday sometime, then in the Houston suburbs friday-saturday, then back in dallas sunday- monday.",FALSE
1642882162381713410,"Erdogan criticizes U.S. envoy Jeff Flake for visiting opposition leader Kilicdaroglu, in anti-Western rhetoric that he typically ramps up ahead of Turkish elections. He adds “we should teach a lesson” to America in the upcoming May 14 polls. https://t.co/NDPbOGtsE4",TRUE
1642882152114311168,"Put money back into your business with a new tax credit that rewards $1,000 per employee for matching contributions. Find out if you qualify by visiting https://t.co/40rSg1opMy https://t.co/akFx4mmM5t",FALSE
1642882145675780098,"#SportsNews: The New York Knicks, who clinched a #playoff spot by pulling away from the visiting Washington Wizards and earning a 118-109 victory on Sunday in the #NBA. https://t.co/1xRf7IzAeI",FALSE
1642882145654849544,Visiting #Huwwara: The Palestinian Town Torched by Illegal Israeli Settlers - Read the latest story by our #WestBank correspondent Fayha Shalash https://t.co/xEDpRvx5xi via @PalestineChron #IsraeliCrimes #Israel #Palestine https://t.co/EI7Qkgi68a,FALSE
1642882144467836928,WXN is proud to recognize Eno Eka &amp; our 2022 Canada’s Most Powerful Women: Top 100 Award winners. Learn about our winners by visiting our website https://t.co/p5fur5ywII &amp; nominate a powerful woman or yourself! #LiveYourTruth #WXNTop100 @CanadianTire @enyconsulting https://t.co/8v8l2OipXx,FALSE
1642882142790381568,"Check out these adorable, seasonal Easter picture books from the Shiawassee District Library by visiting the catalog, https://t.co/zQWeE6qaSd, and reserving one today! https://t.co/0Ny7WUQG8K",FALSE
1642882105200836613,It was a pleasure visiting and I look forward to what we can do around our discussion 🙏,FALSE
1642882085290426374,Can you please support our fundraising by visiting our wishlist https://t.co/yQBIHlIGIG,FALSE
1642882036653236224,Planning on visiting Neotokyo this week. It's a new Japanese cyberpunk-themed noodle bar in Montreal. Going to wear my Azuki TTJ and immerse myself in the vibe. Will share pics. https://t.co/wGnWsdhcML,FALSE
1642882028000497664,"@Joeypits @scottcaris @Rainmaker1973 I don't think anyone would. I'm amazed by what generative AI can do (hell, I work in AI research myself), but I have zero interest in visiting AI art galleries, using AI art in my projects, or anything of the likes.",FALSE
1642882005137227777,I will be visiting Eastern Michigan on April 14 ! @Coach_Collett @Coach_Creighton https://t.co/RMneQbap38,FALSE
1642881999961481216,My body type is not that of one who lives in the gym… you can tell I be visiting that bih tho….,FALSE
1642881948493201410,"Is Nabeen Pattnaik an Odia? No he is 25% Odia and 75% non-Odia. He hardly respects the Odia since he came to Odisha. BJP Slams Odisha CM, Says Naveen Should Have Gone To Kotia Before Visiting Japan https://t.co/E8LJ1ABUWr",TRUE
1642881900573507585,‘Nothing says country music more than drag queens’: CMT Music Awards goes ‘woke’ https://t.co/W1sDqEAADZ via @BIZPACReview,FALSE
1642881896429367297,"Visiting those classic Sire samplers reminded me of this song, which is unavailable on Spotify. #Erasure https://t.co/Lj57SzckPB (cc: @erasureinfo)",FALSE
1642881831875018753,@LifeOfIncursion They are all visiting China...🤔,FALSE
1642881808206266368,"@PMSimferopol Beautiful. Thanks for posting this. I look forward to visiting liberated Crimea. Hopefully, all Russian NaZi’s will be chased away soon!",FALSE
1642881807434543104,"@LitghtningB Anecdotal experiences are no match for quantitative data, be serious",FALSE
1642881800442658817,"@CheapeDouglas I'm visiting you in future purely to have you cook for me and my mister. Just thought I'd be up-front about that. Oh, and for the dogs.",FALSE
1642881783384666113,Happy to share that I will be visiting @csbdresden for the next 6 months! Looking forward for new collaborations in this exciting environment :) https://t.co/jaSL7kf9mK,FALSE
1642881777822756865,"Spent a ridiculously amazing weekend in DC with college friends visiting some of their top independent bookstores, @lostcitybooks @Loyaltybooks @PoliticsProse. I’ve been all in on escapist fantasy and fiction the last 2 years and am excited to dive back into nonfiction! #bookish https://t.co/wElUhA49hV",FALSE
1642881768247132161,"I’ve been off Twitter settling in to my new job, but figured I’ll come back today! President Biden is visiting a clean energy plant in Fridley Minnesota as part of his “Investing in America” tour. Stay tuned for more coverage! https://t.co/zxxZZvADwc",TRUE
1642881760013713414,Me and Paige met some guys from Portugal who was visiting the city yesterday and hung out with them.. they really made our day 😌,FALSE
1642881704934137861,🇹🇷 The University of Balamand’s Vice President for Internationalisation &amp; Engagement visiting @IMTAtlantique Great meeting to reinforce our partnership ! https://t.co/CD6QBJ4HhW,TRUE
1642881691638435840,@garygastelu There’s so many sociological implications here. She’s likely only dating men with a certain means. Many of the countries she’s visiting the average population has huge wealth disparities to Americans. Even in my southern Italian home Americans vastly out earn 80% of the pop.,FALSE
1642881662550720515,"#TheQoute ""There is a potential for #Ethiopia and #Eritrea to work together in the field of technology."" Via @fanatelevision General Abraha Kasa [sic], Head of #Eritrea #NSA &amp; coordinator of the Senior #Eritrea military/security officers visiting #Ethiopia #AI agency. https://t.co/rILPn1HkWe",TRUE
1642881657530200064,My hometown. Would be visiting soon,FALSE
1642881636978290689,Escape the Crowds This Summer By Visiting These ’Least Visited’ US National Parks https://t.co/pa1A4PSbDr #travelsfromjupiter #NationalParks #adventuretravel @UPROXX,FALSE
1642881581726539780,@Route2FI Learning and travel! Ideally I'd be visiting a place with my target language (let's say for a month at a time) and learn from a tutor there daily or every other day and alternate lessons for a specific instrument. I'd also like to spend some time working on farms (ie. WWOOF),FALSE
1642881528492441601,Can @SDhawan25 help @WhoSunilGrover make his dream of visiting the UK come true? Find out in United Kacche on @Zee5india. #UnitedKacche #ZEE5 #SunilGrover #UK https://t.co/doO7o3K7wc,TRUE
1642881512176492548,"Fvcked a married lady in my department on the day she came visiting for assistance on assignment. Since then, this lady has made me her weekend husband. I chop and fuck for free Kwasu",FALSE
1642881471315689476,I love visiting these stores and then say why is everything so expensive! https://t.co/8iNAPhwok7,FALSE
1642881418329202688,"For A Second Year, Wind Farms Have Reneged On Electricity Contracts https://t.co/YwpWT4sSQu via @ccdeditor",FALSE
1642881374934687750,"Despite launching the new brand, we were as busy as ever visiting some unique and wonderful venues. Take a look at where we've been in our newly rebranded Weekly Travels... 📍The Londoner, Frameless, @HiltonBhamMet, The Haymarket Hotel in London and De Vere Beaumont Estate. https://t.co/yaIDOUOYRc",FALSE
1642881352788844545,"6. We also see this black hooded figure which I believe is Rilas trying to scare the girls out of the hotel. It appears and then disappears like a ghost, visiting everyone and haunting them. https://t.co/cArmgVS7nN",FALSE
1642881312481525760,"@97fmRadiocity No Name: My financially supportive friend, years ago, confided in me about his ex; he had been searching for her. He's visiting soon, but I just discovered that my current fiance is his ex. She is not aware too. Should I break up, knowing how much he loved her?",FALSE
1642881281183608832,📣 Calling all business leaders in the North West Apply to our next 90% subsided 12-week #HelpToGrow: Management course starting 11 May! Step through the door to growth today by visiting - https://t.co/gQYxVSZ7ya https://t.co/cUJerPWT0B,FALSE
1642881187784937474,@CBSSunday @JohnFetterman It was clear in the debate this individual had no business visiting the senate and absolutely should not be serving in it. The collar people don’t have a choice but to get up and work in the morning. This never should have happened and his wife should be ashamed.,TRUE
1642881172958072834,@id_gray1 @GBNEWS We don't know the charges yet...,FALSE
1642881161008381952,@iam_wilsons @SkySportsPL Visiting Brighton is the headache . We’ll always fuck spurs anywhere,FALSE
1642881144629673985,Trump took office visiting and praising Putin as if Putin was our ally. He told us who he is from day one.,TRUE
1642881140246605826,USC WR Jordan Addison Visiting Five Teams Before Draft #BaltimoreRavens #Ravens #GoRavens #RavensFlock https://t.co/iqjs54DBpb,TRUE
1642881134026522624,Visiting a farm over the school holiday? Make sure your little ones wash their hands thoroughly to keep them safe from any bacteria https://t.co/HB4FsNHukM,FALSE
1642881133917396992,Calling all Broward County Employers Gain an extra set of hands to boost your productivity and an opportunity to influence our future workforce. Contact us today by visiting: https://t.co/qkHFzP6nLL #SYEP #Broward #Business https://t.co/hFqF10NUTv,FALSE
1642881132315172875,"Real-Time Assessment and Feedback - Online learning provides real-time feedback to both employees and organizations, ensuring a more efficient learning process. Get started on your digital learning journey by visiting https://t.co/A3gCcHApRq. #education #vigilearn",FALSE
1642881132264845314,"""I have registered for @shibacryptonft mint at @nftupcoming; you can also do it the same by visiting their #Mint page: mint https://t.co/I5SX87yRVv""",FALSE
1642881125964996609,@khushsundar @narendramodi We want to see you working on ground visiting villages and exploring and convincing people to join BJP and vote the party to change the corrupt government as Mr Annamalai is trying to win the hearts of millions Tamilions,TRUE
1642880982964371463,@PMSimferopol This summer we are all visiting Crimea but unfortunately you had to leave and missed the big party! https://t.co/cFgru88y8e,FALSE
1642880923526889473,"@MediZense Ah yes! I am a dream Vtuber so i can be anything, and we can do anything~ Like visiting video game worlds! But sometimes i happen to turn into nightmares or wet dreams 😘",FALSE
1642880868074094595,"@AtvAsena Good news for #Eritrea and #Ethiopia, but headache news for the terrorist #TPLF and their supporters. Senior commanders and officers of Eritrean Defense Forces, led by the National Security Agency, are visiting Ethiopia.",TRUE
1642880839649222658,Monday morning visiting UD Ibiza 🌊🇪🇸 (didn't go for a Coke nameset unfortunately 😉) I'm liking the pinstripes on this home shirt! Very smart. I have quite a random collection of Segunda division shirts now and I bloody love it. https://t.co/giyedPOSmk,FALSE
1642880805033607169,"@martinplaut Good news for #Eritrea and #Ethiopia, but headache news for the terrorist #TPLF and their supporters. Senior commanders and officers of Eritrean Defense Forces, led by the National Security Agency, are visiting Ethiopia.",TRUE
1642880776134901762,Big Action by Education Minister @harjotbains against pvt schools for arbitrary loot🔥 ➡️1600+ complaints in first 24hrs ➡️Notices issued to 30 non-compliant schools ➡️EM Task Force is verifying complaints by visiting schools,TRUE
1642880723513229313,"@AtvAsena Good news for #Eritrea and #Ethiopia, but headache news for the terrorist #TPLF and their supporters. Senior commanders and officers of Eritrean Defense Forces, led by the National Security Agency, are visiting Ethiopia.",TRUE
1642880685504430083,"I wish Congress would stop spending taxpayers money every time they visit the border to see if there actually is a crisis,We have already surpassed that while you’re visiting the border millions continue to cross and your president says back and laughs at everyone especially you",TRUE
1642880633046196228,Rijksmuseum Travel Guide: What to Know When Visiting https://t.co/Ql3qxCL59m @viatravelers,FALSE
1642880617628180480,"Murad, the eldest son of the martyr, says: “The occupation prevented me from visiting my father, and communicating with him was difficult due to the circumstances of the captivity.” https://t.co/7Y8s0FuR3s",FALSE
1642880588775342080,Noone: Me: Currently visiting a place where Imran Khan is a superstar &amp; Dil Dhadakne Do is an iconic cult classic.,FALSE
1642880571343880194,"""I have registered for @Cutegirls_club mint at @nftupcoming; you can also do it the same by visiting their #Mint page: mint https://t.co/yw2gIEBn5L""",FALSE
1642880534006190080,@peycarterauthor the feral rabbit (my teen version of easter bunny) will be visiting and we get to celebrate my grandparent's 50th anniversary -- so a lot of exciting stuff!,FALSE
1642880517237293057,"@atrupar This looks like a storyline where Vince's Brazilian cousin, Vincente Manos, comes visiting and tries to steal the WWE (and Vince's family) out from under him.",FALSE
1642880482219098112,I'm visiting at Amber Dalton's blog today. Click on over and get acquainted with Louisa from NEW DREAMS. #CharacterInterview – “New Dreams” by Ellen Parker (https://t.co/olVysEodke) #wrpbks #historicalromance,FALSE
1642880455438397444,"Thank you Cllr @bevcraig (Leader of Manchester City Council), Cllr Jawad Amin and Cllr Fiaz Riasat for visiting The Nicky today and learning about our fantastic facilities and how members enjoy the Social Club environment. Thanks to Marc Levy (MJRC) for organising. https://t.co/T7vx6YqInt",TRUE
1642880453462900740,@muneebqadirmmq Hez the same clown nabeel gabool who gave his visiting card to angelina Julie during her visit to pakistan (earth quake). Bhai ka level or calibre he or ha,FALSE
1642880448262029316,"#BJP Slams #Odisha #CM, Says #Naveen Should Have Gone To #Kotia Before Visiting #Japan #odishabytes #odishabytesnews https://t.co/CnwyAAG5MI",TRUE
1642880380767203329,"""I have registered for @Drpunks_nft mint at @nftupcoming; you can also do it the same by visiting their #Mint page: mint https://t.co/08OKAnZEvo""",FALSE
1642880371820724224,Botan’s visiting Flare’s house in Minecraft 🥰,FALSE
1642880369488740352,"@WestlandPerry @LebbyRachel1 meet Perry..will be visiting him when you're over this month. Great guy and his boyfriend 😜 Perry is a bit cheeky though, but if you ask him nicely, he will show you his organ😉 And he's got a nice swing 👍 😂😂 Perry get the drinks ready for a bit of Kink 😜😉😂",FALSE
1642880329789870081,"I'm not gonna lie. It was like coming home - no, it's like visiting an old home rather. Nostalgic yet painful. But I'll pay for the consequences later on.",FALSE
1642880311552868353,"@virginmedia - I am living in Luton and facing a virgin media internet connection, Last week it's been a nightmare for internet connect . We had two engineers visiting us and giving a different reason and the moment the engineer leaves the internet connection got lost, Any help?",FALSE
1642880231424892931,Did you know we offer In House Valuations at various Jewellers across the UK? Our registered valuer David Baker will be visiting #jacobsjewellers on 12th April to appraise items dropped off in store. For more information on our In House Service contact us on info@gvj.org.uk. https://t.co/RmYA7F5afy,FALSE
1642880177389686786,@urvish2020 But didn't INC betray people for not bringing to books the perpetrators of 2002 riots. They did nothing from 2094-2014 being in power. Now pay heavily. Was RG visiting Surat for a picnic. It's a self goal by INC. Fools.,TRUE
1642880175728648195,"@marose @icarusroses The Glory was the first one I watched a few weeks ago! Everyone is so pretty and stylish, the whole picture is so pleasing 🥹 and visiting South Korea one day is an absolute dream now.",FALSE
1642880161166110721,"Lovely. That wine glass is awesome. ""Merlot"" is the go to brand I buy for parties, while visiting friends. One will never go wrong with Merlot.",FALSE
1642880129767440385,@TropicalSpanish In Turkish you'd also ask someone who's visiting you: Aç mısın? / Are you hungry?,FALSE
1642880127984910337,"""I have registered for @StarSeedNFT mint at @nftupcoming; you can also do it the same by visiting their #Mint page: mint https://t.co/yNFMk0T4jp""",FALSE
1642880084431257606,"So funny. I am in Cleveland now visiting family, not to mention working hard for you, and a registered Ohioan just told me, “I’d much rather the Cavs face New Jersey than the Knicks.”",FALSE
1642880043239047170,@BurnsideJoy Not my dogs. Just visiting puppies,FALSE
1642880024872116227,@ElMagicalMajo do what u wanna do but have fun visiting the college and then wage slaving 🫡,FALSE
1642879981251436544,Visiting Europe? The #beautyofCroatia can be found in its many #naturalwonders. https://t.co/SMPEcHh9Y7 https://t.co/YfjNRQ4F5U,FALSE
1642879971638251521,CANADA STILL HASN’T SEEN 20C; FREEZING MARCH ACROSS SCANDINAVIA; DEADLY NORWEGIAN AVALANCHES; MONTHLY LOWS FALL IN ARGENTINA; + SNOW STRIKES NORTHERN CHINA https://t.co/FogV8MgqgF #GrandSolarMinimum @Electroversenet,FALSE
1642879954726559747,@JohnssonKatie Oh Sugar I'm so sorry you are feeling sad......he will be back and you will have fun times visiting. Lots of goodies too i bet.....🐾🥰💕,FALSE
1642879916831121409,@lilithlastwitch Interesting looking to see you posting visiting Saudi,FALSE
1642879900766879748,Could you be entitled to benefit support? 🤔 Check your eligibility in 10 minutes by visiting https://t.co/sf37wSmXyC For FAQ’s on benefits please visit https://t.co/PBgsihmb8A Find help local to you. Visit https://t.co/AkNjDa5Dn1 #HelpingHandTameside https://t.co/RYsjs4LjrF,FALSE
1642879887642902528,@PeterEgan6 @BeingBoycie @HelpingRhinos @sjones10 Love Rhino's What a great place you must be visiting.,FALSE
1642879875668234243,"Join us at Honors Convocation this Friday, April 7 from 5–6 pm! We’ll be honoring the students who made the Dean’s List, presenting awards &amp; fellowships, and naming the Class of ’23 Valedictorian 🥳 📍Graham Auditorium, or attend from anywhere by visiting https://t.co/Pf089SrpXt https://t.co/ZtfSD5LykS",FALSE
1642879869104078850,"""I have registered for @LunaHunters mint at @nftupcoming; you can also do it the same by visiting their #Mint page: mint https://t.co/RdZCKiW10o""",FALSE
1642879854902386689,@musica08685381 月5本は無料で読めますよ。 Visiting Forces Agreementの話として読んでます。,FALSE
1642879830017339392,@JaneHutt @BarryLibrary Thanks for visiting @JaneHutt!,FALSE
1642879818432757762,"My lovely fellow Nigerians in diaspora, good day, please just in case you're planning on visiting Nigeria &amp; you need to book a place to stay in Lagos. Please kindly contact me to help you secure the best airbnb short-let apartments in Lagos. Stress free..☎",FALSE
1642879759846703106,@byjohnnyjordan Visiting barcelona anytime soon??,FALSE
1642879741488185347,4-Star DE/Central Florida Commit Sincere Edwards Visiting Pitt Today https://t.co/FOKbBedpTS via @pghsportsnow https://t.co/C7X7j9rbWG,FALSE
1642879693614379008,"Going to head off to the Midwest later this week. Really looking forward to visiting Omaha’s @JSBooksellers, one of my favorite bookstores in the world. Also, going to do some “investigation” re: consumer services. How crowded are restaurants? How busy are downtowns?",FALSE
1642879676413628416,Donate a pack of 60 adult diapers at just Rs 2800/- Support us by visiting: https://t.co/g9cvK18dVo or scan the QR code Reviews:,FALSE
1642879674823987203,"@jogakhichudi Vip culture negates the entire purpose of visiting a temple, which is to surrender the ego What appears on the surface like a convenience is infact a curse",FALSE
1642898981486469121,"外交部发言人华春莹3日宣布：应国家主席习近平邀请，法国总统马克龙将于4月5日至7日对中国进行国事访问。 At the invitation of President Xi Jinping, French President Macron will pay a state visit to China from April 5 to 7, Foreign Ministry spokeswoman Hua Chunying announced Wednesday.",TRUE
1642898890327306241,@o_biennis … curious though that all the k-press are insisting Jill Biden made the performance event suggestion/request but don’t see any other int’l press reporting on this. Just seems odd that the US would even suggest a Carnegie Hall event alongside a state visit?,TRUE
1642892435620610049,Air Noland finds clarity after Ohio State visit: ‘I know where I’m going’ @AriWasserman https://t.co/KQYVSF3n60,TRUE
1642891543986962432,@suze650 @scobie @msfoundation Considering he just had his first state visit as monarch to Germany is pretty worth noting as well as the day-to-day engagements carried by the other members of the RF.,TRUE
1642890695466688512,"#WATCH | Bhutan King, #JigmeKhesarNamgyelWangchuck arrives in India on a three-day state visit. He was received by EAM @DrSJaishankar at the airport. @MEAIndia https://t.co/wFZoa1blGK",TRUE
1642887277952258050,and monsieur Macron has no problem befriending Xi 🤯- state visit to China this week will be cringe af. https://t.co/TsVhqK1jTm,TRUE
1642885663501725696,"#China hopes to take French President #EmmanuelMacron's state visit to China as an opportunity to boost ties with #France and the European Union (#EU), a spokesperson said on Monday. https://t.co/II5iSIPh3I",TRUE
1642884624975011840,"At the invitation of President Xi Jinping, French President Emmanuel Macron will pay a state visit to China from April 5 to 7. 法国总统马克龙将于4月5日至7日访华 https://t.co/M0FARU8luY",TRUE
1642884174594949121,"FM Spokesperson Hua Chunying: At the invitation of President Xi Jinping, President Emmanuel Macron will pay a state visit to China from April 5 to 7.",TRUE
1642883924043919365,His Majesty The King and German President last week on the official overseas state visit of King Charles’ reign. https://t.co/7kPIXy5Qoq,TRUE
1642882148179886085,"China hopes to take French President Emmanuel Macron's state visit to China as an opportunity to boost ties with France and the EU, Chinese foreign ministry spokesperson Mao Ning made the comment on Monday in response to queries on Macron's state visit to China from April 5 to 7. https://t.co/l71fLhnBmB",TRUE
1642881635925229573,@tbatde @angelalevin1 @SkyNewsAust Personally I agree but that wasn’t my point. The court case date had nothing to do with Charles &amp; Camillas (highly successful) state visit.,TRUE
1642879227337879552,"@jomilleweb King Charles has 75 years of Training in being King &amp; actually spent the last 3 years of Queen Elizabeth's Reign, standing in for her during State Opening of Parliament and Remenberance Sunday Ceremonies, because she was too frail. King has made very successful German State Visit",TRUE
1642879081308909568,@silver_lining85 @duchess_salty This case was just an opportunity to usurp KCIII &amp; QC first State visit to France. Nobody could have forseen the postponement of same. Court date came in handy. I don't believe Harry would have come over for it if the State visits weren't scheduled for the same time.,TRUE
1642879002799927299,"Thank you for visiting ""us"": The state visit to France, I hope, will follow suit after His Majesty's Coronation. @CerstinGammelin @EmmanuelMacron @SZ",TRUE
1642877607606624258,Just trying to clarify because I think many of you are confused. A state visit is multiple days and consist of many events. The state dinner is it’s own event. Blackpink would perform at a different event. A date which we don’t know. That’s why it’s still potentially possible.,TRUE
1642876498158968834,"At the invitation of Chinese President Xi Jinping, French President Emmanuel Macron will pay a state visit to China from April 5 to 7",TRUE
1642875952731676672,"At the invitation of Chinese President Xi Jinping, French President Emmanuel #Macron will pay a state visit to #China from April 5 to 7. #XiJinping https://t.co/I00lrjvejM",TRUE
1642875646270472193,"@jhoffman1 @JewishChron Yes he can go on holiday. A state visit is different and is a matter for the Foreign Office, which is why there have been no UK state visits to Israel.",TRUE
1642873570677374980,"Reception in Hamburg, Germany during last day of royal state visit by TM KC3 &amp; QCCam. Timer is counting backwards. Start at 2:20ish and 0:30ish.😉😉",TRUE
