ID,Data,Classification
1642900590383747073,"🚨🚨🚨 🇺🇦🇫🇮 ️ Zelensky will make an official visit to Poland on April 05 During the visit, the President of Ukraine will meet with Polish President Andrzej Duda, as well as with Ukrainians who are in Poland https://t.co/O3ElrSX0Wd",TRUE
1642900183175528448,Book your appointment at 416.707.5125 Or Visit our website for more information: https://t.co/DhNFRiQJ5L #storefixtureworks #millworkdesign #designerretailsstorecabinets #storecabinetservices #ssfw_official #storefixturesanddisplays #cannabisstore https://t.co/4loL39HlZr,FALSE
1642900119077941249,4⭐️ OL Waltclaire Flynn has set his first official visit. He’s also seen an uptick in interest from one program. Another program has become intriguing as the QB dominoes have begun falling. More from Flynn: https://t.co/vORZsYr0Jr https://t.co/1mgXoPUNPp,FALSE
1642899231374467072,The Qatari official will meet a number of Lebanese officials during his one-day visit. https://t.co/8T5LzumnJK,TRUE
1642899199720030208,The French State Secretary of the Ministry of Europe and Foreign Affairs arrived in Ghana last weekend and paid an official visit to the Osu Fort https://t.co/l42JbZlFUT,TRUE
1642898745258917893,"Boston College really impressed RB Gideon Ituka on his recent unofficial visit. So much, in fact, that he's planning to return for an official visit in June. He tells us what other officials he plans to take https://t.co/dc9GPSrhuZ",TRUE
1642898739089080321,"Poland handed over several MiG-29 fighter jets to Ukraine, the presidential office reported Also, the International Policy Bureau of the Office of the President of Poland reported that Volodymyr Zelenskyi will pay an official visit to their country on Wednesday, April 5. https://t.co/clfs4OXJPu",TRUE
1642897478398910464,"Who is Allah? To know, Download official App or visit our YouTube channel ""Sant Rampal Ji Maharaj"" Baakhabar Sant Rampal Ji #True_Allah_Kabir Baakhabar Sant Rampal Ji https://t.co/aTcLjt07l6",FALSE
1642897224588820481,@official_as_s @AstonUniversity @visit_bham @birmingham_live Lovely pictures 👌 🤗,FALSE
1642896991112790019,"“We cannot undo in a day what has been done for decades, but we must take sensible steps to do so.” - Dan Peña My official site is now up! Visit https://t.co/KAWNqoITSa https://t.co/22Rtoj2CHY",FALSE
1642896976269172736,Four-star WR @thealextaylor3's official visit schedule is nearly completed: https://t.co/7jOQ0foLGb (VIP) @grimsleyfb @RecruitGrimsley @CoachGalloway7 @CoachMackBrown @__alexwhite @BrianDohn247 @AnnaH247 @MichaelClarkPP https://t.co/emGRn4FwDO,FALSE
1642896719464521729,It's 1973 and @Official_STFC physio Kevin Morris pays Australian actress Annette Andre a visit while she was in town Both look rather bemused and Kevin dies not have his trademark pipe Annette is still with us aged 84 now #stfc https://t.co/qqpGBenNli,FALSE
1642896653131694081,"#Beijing has raised concerns about a proposed #SecurityAgreement between #PapuaNewGuinea and #Australia, the #pacificisland country’s foreign minister said Monday as he returned home from an official visit to #China seeking development assistance for his nation.…",TRUE
1642896594923057155,"End of our second official meeting of the Roxeth Park Friends Group - plenty of discussion &amp; progress taking place on our 5 year plan... two events in the pipeline coming up which are open to all: 🧹 Next Tues, 11/04 at 10AM ahead of the Green Flag visit, we are organising (1/3) https://t.co/ck30t9GThX",FALSE
1642896564636258309,"Who is the Baakhabar? To know, Download our Official App or visit our YouTube Channel ""Sant Rampal Ji Maharaj"" #ramadan2023 #SantRampalJiMaharaj https://t.co/8j2MYASz8B",FALSE
1642896555362381832,Four-star WR Alex Taylor's official visit schedule is nearly completed: https://t.co/ZgLxLjbZdj (VIP) https://t.co/TI5aKUZKJR,FALSE
1642896549847126017,@backpackergirl3 All SBI Credit Cards concerns/queries need to be directed to @SBICard_Connect. For more information please visit https://t.co/fTda2R03cX,FALSE
1642896369030496256,"This is the future of mobile gaming! 🙌 Play whenever, wherever, however you want with Duelit! 📲 Visit https://t.co/A61RRhUzFb to learn more. #duelit #egaming #esports #mobilegaming #gamingapp #appdownload #mobilegames #onlinegaming #mobileesports #igaming #mobi… https://t.co/vQ0hIFW2Tj",FALSE
1642896220153675777,"@official_as_s @AstonUniversity @visit_bham @birmingham_live By the time you done wth season 2,you'd be a celeb already 😁😁. So good to see beautiful pictures",FALSE
1642896219717468165,@bagplants @Ivyyprophen It’s the reason I never visit anything but following and notifications,FALSE
1642896196296491008,Official Presidential Visit of His Excellency José Maria Neves at Brockt... https://t.co/PwUWigghnh via @YouTube,TRUE
1642896105523544065,#GodMorningMonday पूर्ण परमात्मा ने मोक्ष प्राप्ति के लिए 84 लाख योनियों से एक अलग जीवन दिया है मानव का। इसी मानव जीवन से हम मोक्ष प्राप्त कर सकते हैं। 👉सत ज्ञान प्राप्त करने के लिए Sant Rampal Ji Maharaj Youtube Channel पर Visit करें। https://t.co/J0tuzoecS2 https://t.co/FT5jJlN5tV,FALSE
1642896017942257667,#GodMorningMonday पूर्ण परमात्मा ने मोक्ष प्राप्ति के लिए 84 लाख योनियों से एक अलग जीवन दिया है मानव का। इसी मानव जीवन से हम मोक्ष प्राप्त कर सकते हैं। 👉सत ज्ञान प्राप्त करने के लिए Sant Rampal Ji Maharaj Youtube Channel पर Visit करें। https://t.co/J0tuzoecS2 https://t.co/VzDVkuEX5J,FALSE
1642895719215276033,@official_as_s @AstonUniversity @visit_bham @birmingham_live Been waiting on this bro …. 🔥 🔥,FALSE
1642895026777903109,"Who is the Baakhabar? To know, Download our Official App or visit our YouTube Channel ""Sant Rampal Ji Maharaj"" #ramadan2023 #SantRampalJiMaharaj https://t.co/okmK17ehr5",FALSE
1642894882799755265,President paid a visit to the wounded warriors in the hospital of the Chernihiv region and presented them with awards — Official website of the President of Ukraine: https://t.co/SaOwZ3lc7M,TRUE
1642894366724493312,"Who is the Baakhabar? To know, Download our Official App or visit our YouTube Channel ""Sant Rampal Ji Maharaj"" #ramadan2023 #SantRampalJiMaharaj https://t.co/C1l3aKCGXu",FALSE
1642894301712773120,"Who is the Baakhabar? To know, Download our Official App or visit our YouTube Channel ""Sant Rampal Ji Maharaj"" #ramadan2023 #SantRampalJiMaharaj https://t.co/WqCkQllGCn",FALSE
1642894213321826306,"☑️The latest on #Clemson's new big-time WR offer ☑️Another 4-star locks in the official visit weekend ☑️A ton of scoop from the underclassmen day Saturday, specifically 5-star David Sanders and another need-to-know 4-star Quite a loaded Monday Insider: https://t.co/JKkiJ9MVfz https://t.co/5Hhsq38EI7",FALSE
1642894140483715074,"🇧🇹 🇮🇳 🤝 His Majesty The King arrived in New Delhi today, on a 3-day official visit at the invitation of India’s President Her Excellency Droupadi Murmur 🙏Kutse Ringwa Sho la🙏 https://t.co/GLEvlzxCl9",TRUE
1642894112767586304,I will visit the channel,FALSE
1642894046967234561,COURTESY VISIT &amp; PRESENTATION OF AWARD TO THE CMD FTHK Courtesy visit by Staff of Federal Teaching Hospital Katsina after the completion of their 14 months Radiation Therapy Training at NSIA Lagos State University Teaching Hospital's Cancer Centre. https://t.co/S6gCjvsxdB,FALSE
1642893985894092803,Foreign Secretary Paudyal To Pay An Official Visit To China https://t.co/cHkEzSgFCj @MofaNepal @PaudyalBR,TRUE
1642893687116922881,"For full Official Rules, visit https://t.co/VYhMJQ2Bpx. Sponsored by Tor Publishing Group, 120 Broadway, New York, NY 10271. The Sweepstakes is in no way sponsored, endorsed or administered by, or associated with, Twitter.",FALSE
1642893614459043841,@SinachOkee Thunder will just visit them😑,FALSE
1642893517088325637,"For those ready to revolutionize their QSRS: visit us #RLPSAConference Booth#1014 and be wowed by our innovative tech solutions! Faster, smarter &amp; better - that’s what we do best with i3’s Ai-based solution 🤩 #DriveThruRevolution #qsr #i3ai #RLPSA #drive-thru #videoanalytics https://t.co/STFDtyAP7q",FALSE
1642893316034383873,2023-04-03 22:14:22 Visit wear official full help cold late. 黑河哪里有上门服务，全套700包夜1500，酒店宾馆都可以去，诚信第一优质服务+扣371878669,FALSE
1642892832158412801,"Welcomed Adviser to @EmmanuelMacron H.E. @isabelledumont in #Tashkent. We had a quite comprehensive agenda focusing on the agreements reached during the official visit of @president_uz to 🇫🇷 last year, ways to facilitate ever-growing ties in all spheres, &amp; joint events for 2023. https://t.co/owIMRRRAO2",TRUE
1642892733801963521,3-star OT from Jacksonville has locked in an official visit to Miami this summer,FALSE
1642892654408024068,"Learn, Earn &amp; Work program by Consultreat collaboration with EurAsia Institute Germany. Check out our new program. Contact on the given number for more information. Visit our website for more information: https://t.co/pGlb8VtDFU #Hospitality #germany #chef #JOBALERT https://t.co/tEZyDS3m2l",FALSE
1642892609185087488,Reward System Part-2 Save Product Price Into the Database https://t.co/2rPntbPOkC If you need any services reach to us through contact@cdlcell.com For more courses visit our official youtube channel. https://t.co/pphY3QhZdc Follow us on: https://t.co/Qwsgc7TPZ4 #laravel,FALSE
1642892593703911425,#AlexanderTechnique helps individuals recognize how they misuse themselves and improve the quality of their movements. Visit our website to find an AT teacher near you — https://t.co/xpSG3M8n1D quick link in our bio👍 https://t.co/Md0GDbwPfX,FALSE
1642892234302566400,Foreign Secretary Paudyal To Pay An Official Visit To China https://t.co/WF5OZwwgp8,TRUE
1642891461094961157,@mahtshuni @IrishMama2010 @flipettydish @SWR666 The sources are in the image. You can visit the official sites yourself and check. 😊,FALSE
1642891359626440704,"We're recruiting now for Clerical Assistants Strathallan Primary School, Kirkcaldy Permanent, 36 hrs/week, 39 weeks/year To apply visit: https://t.co/2izbdN5Z0w Kinglassie Primary School, Lochgelly Permanent, 9 hrs/week, 39 weeks/year To apply visit: https://t.co/fPo4IvoXfw https://t.co/eB3TfisltJ",FALSE
1642891013101371392,"Creating a business app on your own could seem like a difficult endeavour, but with Fluper's assistance, it is simple to do! To know more visit our website https://t.co/HJfggrATl1 #fluper #mobileappdevelopment #mobileapplication #mobilegames https://t.co/wWZurTnv7w",FALSE
1642890958135242753,"Who is the Baakhabar? To know, Download our Official App or visit our YouTube Channel ""Sant Rampal Ji Maharaj"" #ramadan2023 #SantRampalJiMaharaj https://t.co/0nSdH3pqN7",FALSE
1642890628408438784,"Visit of the Principal Secretary, PR &amp; DW Dept. to Puri district to review the Water Supply Projects. @CMO_Odisha @samarth_verma @MoSarkar5T @Puri_Official @mopr_goi @PRDeptOdisha https://t.co/q9hLHKV3EM",FALSE
1642890553468780545,"who is the Baakhaber To know, Download our Official App or visit our You Tube Channel ""Sant Rampal Ji Maharaj"" #ramadan2023 #SantRampalJiMahara https://t.co/2wSZ27KJg8",FALSE
1642890393283964928,"Is your child a Rockin’ Robin member? Visit our website https://t.co/mV91b8pEzB to print the official Credit Union Youth Month coloring page, let your child color it, and submit it for their chance to win a $50 deposit to their account. They will also be featured on social media! https://t.co/LxhDtuxRM5",FALSE
1642890345645064194,"We are truly thankful for all of the hard work and efforts of our officials in Conference Carolinas. If you know of anyone interested in becoming an official, please have them visit ⤵ 🔗: https://t.co/w9mZL57La3 #ThankARef | #LeadingTheWay https://t.co/SB6VReyCga",FALSE
1642890288506044416,King of Bhutan Jigme Wangchuck arrives in Delhi for a 3-day official visit https://t.co/KHShYXpKmO,TRUE
1642890225465851904,"#GodNightMonday Visit ⤵️⤵️ Download our official app ""Sant Rampal Ji Maharaj"" In Playstore से करें। https://t.co/IqI05kKPeH",FALSE
1642890049711927296,"#GodNightMonday Visit ⤵️⤵️ Download our official app ""Sant Rampal Ji Maharaj"" In Playstore से करें। https://t.co/T90Tdoi7Y9",FALSE
1642889918006583297,"#GodNightMonday Visit ⤵️⤵️ Download our official app ""Sant Rampal Ji Maharaj"" In Playstore से करें। https://t.co/NCJ5y4ZLYM",FALSE
1642889897605308416,Check out what's included in the LOCK401 PENTESTER Advanced PACK. visit: https://t.co/8xQmEfxlXI #lockpicking #locksport #locksportcommunity #locksmith #openlock #lock401 #lockpicks #lockpickingtools #lockpickingtraining https://t.co/zHBzdukZT0,FALSE
1642889782245335040,"Who is the Baakhabar......❓️🙇‍♀️🙇‍♀️ To know, Download our Official App or visit our YouTube Channel ""Sant Rampal Ji Maharaj"" #ramadan2023 #SantRampalJiMaharaj https://t.co/hBPFK1DfUX",FALSE
1642889699948888073,"From 13th to 15th April, visit us booth 14902 at the @NAMM Show in the Anaheim Convention Center (California). Come and enjoy the demonstrations of an Atmos 9.2.4 system, the studio monitors of the ST6 range as well as the professional headphones. https://t.co/6K56pfElMZ",FALSE
1642889698703036420,"28 et 29-mar: Le CG Saito, temporairement de retour au Japon, était en visite officielle aux villes de Hakodate et Sapporo, Hokkaido. Mar-28 &amp; 29: CG Saito, temporarily back in Japan, was on official visit to the cities of Hakodate and Sapporo, Hokkaido. https://t.co/3DvkWw9GLR https://t.co/QTeJPp6M6P",TRUE
1642889681133264897,"Who is the Baakhabar......❓️ To know, Download our Official App or visit our YouTube Channel ""Sant Rampal Ji Maharaj"" #ramadan2023 #SantRampalJiMaharaj https://t.co/S9iRIR3gb4",FALSE
1642887244670173186,"On April 3-4, Minister of Foreign Affairs Kuleba will visit Brussels to participate in the official meeting of the Ukraine-NATO Commission. Ukraine will become a leading state in implementing innovations in cyber security, protection of critical infrastructure &gt;&gt;/11",TRUE
1642887230141112325,"#GodNightMonday Visit ⤵️⤵️ Download our official app ""Sant Rampal Ji Maharaj"" In Playstore से करें। https://t.co/267rqbfwkP",FALSE
1642887221630976000,"On April 3-4, Minister of Foreign Affairs Kuleba will visit Brussels to participate in the official meeting of the 🇺🇦 NATO Commission This will be the first meeting of the Ukraine-NATO commission since 2017, when the law on education, opposed by Hungary, was adopted.💪💪💪💙💛 https://t.co/DJkhLwi5Jy",TRUE
1642887173602160640,Digital Marketing Solution 101 has the tools and expertise to help you achieve your web design goals. Visit our website today to learn more! Email us at support@digitalmarketingsolution101.com to get started. #customdesign #userexperience https://t.co/KLEIJoKYGP https://t.co/r8VzeCbw3c,FALSE
1642886489720619008,"Bhutanese King Jigme Khesar Namgyel Wangchuck on Monday began his two-day trip to India with External Affairs Minister S Jaishankar receiving him at the airport here, reflecting the importance New Delhi has attached to the visit. #BhutaneseKing #JigmeKhesarNamgyelWangchuck…",TRUE
1642885247887876096,"2024 DB Cam Richardson quickly schedules official visit to #Wisconsin ""The bond I have with everyone there made me want to be back on campus real soon” https://t.co/Lf5heSZwjM",FALSE
1642885226069196809,Keep up to date with all things teaching - cutting edge conversations and all the latest news and views - follow Teachers Talk Radio on your podcast platforms or visit our listen back page on the website!,FALSE
1642884773608669187,@official_as_s @AstonUniversity @visit_bham @birmingham_live Love your content pieces! Always looking forward to the next.,FALSE
1642884719015522308,"#True_Allah_Kabir Visit ⤵️⤵️ Download our official app ""Sant Rampal Ji Maharaj"" In Playstore से करें",FALSE
1642884319986286598,"#WomenLeadSocialChange For more info, visit https://t.co/koDnlBgIhM",FALSE
1642884056550449153,"I’m late to the game, but since I’m flying out today for a week-long writing retreat (and long overdue bff visit) with @saint_ames, consider this my official declaration of participating in #CampNano. At least for the next week! Let’s set a 20k word goal, just because.",FALSE
1642883969032114177,"Strong and sincere words of support for Ukraine from Eduard Heger, PM of Slovakia ⁦@eduardheger⁩ during his visit. Thank you 🇸🇰. 📹 Zelenskiy Official Instagram. https://t.co/HKGP4r7QSC",TRUE
1642883650634039297,"On300 4-star OT Manasse Itete to take Miami Hurricanes official visit, continuing to ponder summer dates - the latest here ... https://t.co/o8uP5RBvbM Get https://t.co/Pl5q2WnOUE access until Aug. 31 for $29.99 … https://t.co/qUUEREuHlj https://t.co/63awSzATF2",FALSE
1642883650395201541,President Volodymyr Zelenskyy will pay an official visit to Poland on April 5. https://t.co/txZpbLx9oi,TRUE
1642883313219125248,Stay fit with a dedicated tennis court at #RunwalBliss in Kanjurmarg East. Be a part of a vibrant gated community at #RunwalCityCentre - a 36-acre mega-campus that serves all of its residents’ needs. Visit: https://t.co/J9aXs5I6cb ​ ​ #RunwalGroup #Kanjurmarg #RealEstate #Mumbai https://t.co/va0YuFEuPn,FALSE
1642882704491401217,"Who is the Baakhabar.....?🙏 To know, Download our Official App or visit our YouTube Channel ""Sant Rampal Ji Maharaj"" #ramadan2023 #SantRampalJiMaharaj https://t.co/L6PQS4JKxv",FALSE
1642882590188109824,"Who is the Baakhabar.....? To know, Download our Official App or visit our YouTube Channel ""Sant Rampal Ji Maharaj"" #ramadan2023 #SantRampalJiMaharaj https://t.co/6BzcW5lJtM",FALSE
1642882471854260224,"Who is the Baakhabar.....? To know, Download our Official App or visit our YouTube Channel ""Sant Rampal Ji Maharaj"" #ramadan2023 #SantRampalJiMaharaj https://t.co/IKYTcDUkeT",FALSE
1642882340023140355,"Who is the Baakhabar.....? To know, Download our Official App or visit our YouTube Channel ""Sant Rampal Ji Maharaj"" #ramadan2023 #SantRampalJiMaharaj https://t.co/GngLCiKXRS",FALSE
1642882336000753664,"Who is the Baakhabar? To know, Download our Official App or visit our YouTube Channel ""Sant Rampal Ji Maharaj"" #ramadan2023 #SantRampalJiMaharaj https://t.co/X0OdMqEI4N",FALSE
1642881778355687424,@IsraelinIndia @AmirOhana @rashtrapatibhvn @VPIndia @KnessetENG @MichaelBiton4 @HaleviAmit @IsraelMFA @NaorGilon @MuhamedHeib @HagarSpiroTal @PIB_India @AmirOhana's first official visit as Speaker of the Parliament is to India. That shows how important is our country to #Israel. It is also the first visit of any #Knesset Speaker to India. The relations are strengthening further under the leadership of @narendramodi &amp; @netanyahu.,TRUE
1642881751520354314,The Gators have an official visit scheduled from a priority in-state OL target: https://t.co/RfgyVdEvMQ,FALSE
1642881637401915392,"#MondayMotivation Q. Who is Allah? Ans. Allah is Kabir. To know, Download official App or visit our YouTube channel ""Sant Rampal Ji Maharaj"" #True_Allah_Kabir #GodMorningMonday https://t.co/ObJvoXWeLz",FALSE
1642881603184521219,"Doing research for Jiggy's hat and did come to the conclusion that in most official art he has a different hat and therefore, I decided that he has one either for each day of the week or LXC just brings him with every visit a new one, because it makes Jiggy happy.",FALSE
1642881505260195844,IN COME THE PEACEKEEPING TROOPS !!!! Zelensky is going to Poland on an official visit Vladimir Zelensky plans to arrive in Poland on April 5. This was stated by the head of the Bureau of International Policy of the Office of the President of Poland Marcin Przydac on the radio… https://t.co/0B6SbLqnEV,TRUE
1642881310275391489,"IT'S OFFICIAL!!! It took a lot of heavy thought to pick between the places that we've dreamed of going to the most for our honeymoon, but we knew in our hearts where we were meant to be. For 9 days we're booked to head to Munich, Germany, we're gonna visit Nuremberg, Mittenwald, https://t.co/4AIOJIoqM8",FALSE
1642880882204893185,Looking for that Team Builder that gets the whole group out the office? Look no further. Multiple copies of each theme available. Visit https://t.co/WGccshYz6B for more! #EscapeRoom #Bristol #MiltonKeynes #Southampton #Exeter,FALSE
1642879624299581442,"The official visit by PM #Kishida indicates that #Japan seeks closer cooperation between the #IndoPacific countries, writes Manoj Joshi https://t.co/oZmcrt5C61",TRUE
1642879583912443904,"Thank you #mrm for hosting us for a plant tour and taking us through the industry discussions on Steel building and roofing solutions during our industrial visit on Friday, 31st March 2023. https://t.co/aPkF1kk0V1",FALSE
1642879564379484162,Exclusive: Malaysia's PM visit to China 'historical'; BRI offers an opportunity to countries to make a choice: Malaysian official https://t.co/9SezaeHBqk #businessinchina #business #economy #Exclusive #Malaysia #PM #visit #China #historical #BRI #offers #opportunity #countries,TRUE
1642879535145164803,@official_as_s @AstonUniversity @visit_bham @birmingham_live Dis lady is really pretty 😘 https://t.co/S72wrAaRre,FALSE
1642878927264788482,That's a wrap For more information visit Twitter: @SNLG_official Telegram: https://t.co/NfxWw0uBJ8 Website: https://t.co/ebms2nXo6X,FALSE
1642878586628739073,Visit Skymon Official to collect Skymon 💫 https://t.co/mziXWgZEsX Download Sky Dream and start the adventure 🌈 🏙 Google Play 👉 https://t.co/mIoqmNAK2T App Store 👉 https://t.co/agWvL58Ft8 https://t.co/IAv5XKIbWY,FALSE
1642878439177830401,"An official visit is being conducted with the objective of developing and managing Free Trade Zone and other related issues. A delegation led by IPDC CEO, Aklilu Tadesse, is on an official visit in the United Arab Emirates. https://t.co/LLMxN84Mf6",TRUE
1642877162209579010,"@ralphsuarez Regarding to your concern, you may call Makati City Traffic number 8844-3146 or visit their Facebook Page. Thank you. #mmda https://t.co/W9uMwJZRAk",FALSE
1642877077568507905,"@Fahad78667 information/documents, they have to visit the Branch along with Original KYC documents and one Photograph for updation of latest KYC documents in the account. (4/4)",FALSE
1642877070815662081,"@Fahad78667 Customers can visit any of our nearest branch for the purpose of KYC updation. For updation of KYC documents in the account, the customers have to submit only a duly filled and signed prescribed format(Annexure A) if there is no change in the KYC information provided (1/4)",FALSE
1642875956359753733,@SkyNewsAust I’m sorry I have to call that out as wrong. When a State Premier travels overseas on official business there would be prior briefings between the Premier’s office and DFAT. DFAT would be coordinating the visit and will likely have cabled the 🇦🇺embassy in Beijing. TI,FALSE
1642875565056073731,When you're with your Chole Bhature lover friend at Dillicacies and they eat all your food 😂🍴🙈 Call Us To Order +91-740-009-6766 Visit us :- https://t.co/81XKmZpEgR #dillicacies #thane #mumbai #hiranandaniestates #foodmemes #foodmeme #foodhumor #funnyfoodpost #funnyfood https://t.co/aXSH0uZIGX,FALSE
1642875484982722560,Reach your goals this year with a chance to win a 6-month WW membership! *New WW members only. See Official Rules for details. Visit https://t.co/2PnSXpPKdw and enter by 5/31.,FALSE
1642875146183536640,SA Air Force || Visit the SA Air Force Official Internet Website @ https://t.co/xKZ2T1UVNN. Information and Design || SA Air Force. #SANDF #SAAirForce #FreeTheEagle https://t.co/7u6eHk9DHG,FALSE
1642874942252351494,A daily reminder to visit my website : https://t.co/j2V3jmCWe3 Love you all!,FALSE
1642874937894633472,"Over 60 BBA LLB final year students from @NLUO_Official had an exposure visit to #OHub, where they gained a better understanding of #Odisha's flourishing #startupecosystem and the State government's support for entrepreneurs. The students had the opportunity to interact with… https://t.co/ynGYlIPQUn",FALSE
1642874858479468545,"NO PURCHASE NECESSARY. MANY ENTER. ONE WILL WIN. Must be US resident 18+ to enter. For Official Rules and Sweepstakes details, visit https://t.co/MNJsOxkxY0.",FALSE
1642874601628737539,"Meet Wina, a 29 year old gorgeous and single woman from China who's seeking for real love and a serious relationship. 💗 If you're as serious about love as her, communicate with her through our website. Visit 👉🏻 https://t.co/D9m1WBHeyz #datetomarry #matchmaking #beautifulwomen https://t.co/Fl8rNtQZ5S",FALSE
1642874592149610497,Today's LME official settlements. Visit Metalmetre for realtime LME quotations! https://t.co/dkeOR1Uah8 #copper #aluminium #nickel #zinc #nonferrous #lead #cobalt #metals #lme https://t.co/0IlRHf508N,FALSE
1642874581471068161,"If you're looking for a chemical manufacturer and supplier (Eco Orro Chemicals Pvt Ltd.), that specialize in producing and distributing various types of chemicals. Visit official website: https://t.co/uM2LRFilN1 #ecoorrochemicals #foundryfl https://t.co/PdJ4MRdT5I",FALSE
