ID,Data,Classification
1642887694769442818,RNC Operational Patrol Services made an arrest following an assault in St. John's yesterday. Please visit our website for more information. #YourRNC https://t.co/bueu90kDni,FALSE
1642887691242201093,"GM! Photographers &amp; Artists, here is #frameoftheday that caught us 👓! Please visit Ronnie's work. Have an excellent day",FALSE
1642887688041689091,"From Routine Maintenance To Major Repairs, We've Got You Covered With Our Full Range Of Car Services! Doorstep Car Services For Busy Schedules. Call or WhatsApp:- 8383999107 Or Visit:- https://t.co/iBYBeQ46Gp . . . #car #cardenting #carpainting #denting #painting #carwash https://t.co/XUkh3aOspQ",FALSE
1642887681599258624,"What better way to celebrate spring than with a brand new waterside pocket park in #Leeds city centre, which is worth a visit for anyone enjoying the city's waterways 🌼 🌼 - https://t.co/fKe5Bmujmm",FALSE
1642887670337794048,"If you can't afford to travel, don't travel. Know you are a guest and don't disgrace yourself, your country, or the place you're fortunate enough to visit by being ignorant. Only you are responsible for yourself, no one else. Smarten up.",FALSE
1642887658941677573,"Visit the Philadelphia Gear® team in booth 140, today through Wednesday, at The Navy League’s Global Maritime Exposition in National Harbor, MD. #SAS2023 #gear https://t.co/snm3zfAsbY",FALSE
1642887643724931072,@chrisparente @katieorth @KenClarkTV @WeatherMichels @channel2kwgn Hey 👋 There to all my favorite mornin’ news peeps!! Time for coffee ☕️ &amp; news!! &amp; of course a much needed sharp lookin’ Parente fix!!! I seriously need to take a trip &amp; visit ya’all🐸🦄🌈❤️🤠🦋,FALSE
1642887631011971072,@BlytheByName I used to have a pair visit me at my old apartment that I defo named Laurie and Keats.,FALSE
1642887627677356032,"Leeds City Museum is the place to be for animal lovers on 12 April, when the lovely folk from Lion Learners are dropping by for animal handling. Our sensory room is back on 11 April too, for families who may find a visit to the museum overwhelming: https://t.co/hrgJ9MyvWi https://t.co/tqQGyoJjT0",FALSE
1642887622728253441,"Provisional net tax mop-up for FY23 registers 17.63% year-on-year growth. For the latest news and updates, visit: https://t.co/gXeGqKQ77P https://t.co/QOlVPBZTNH",FALSE
1642887618990833666,"Our vision for all coastal communities To learn more about SFACT’s vision, visit our website, https://t.co/ho6eTJBw6P. #transparency #fisheries #indianocean #overexploitation https://t.co/OlDCPhYLXD",FALSE
1642887617896144906,Visit our sites: Blog at https://t.co/GhDqEP1gKS Time management app at https://t.co/KibHE1tpBS #timemanagement #success #habit #productivity #motivationmonday #motivation #motivationalquotes https://t.co/D8nyH3a8hX,FALSE
1642887612565159938,"We are delighted to announce our new spring signing bonus for selected roles. To find out what roles we have available, please visit: https://t.co/daFOe9YxLG *Terms and conditions apply #northeast #recruitment #trainingcourses #northeastjobs #motortradejobs https://t.co/JJxm4zifT9",FALSE
1642887604592062464,@joskidadex @LifeOfNapaul Here's your screenshot. ⚡ Want to automatically post your tweets on Instagram? Visit https://t.co/6fIpjtKrSz. https://t.co/1KBAtx2uJu,FALSE
1642887602381684736,"For more details, please visit ""Career"" section of RGNAU website i.e. https://t.co/NmAYfkkw6p. (2/2)",FALSE
1642887590985760770,Foreign secretary Bharat Raj Paudyal to visit China https://t.co/Mwq67lxExM @PaudyalBR #BharatRajPaudyal #China #epardafas,TRUE
1642887585839173632,"✅✅ चिकित्सा महासभा RD HOSTEL GROUND, SMS MEDICAL COLLEGE, JLN MARG, JAIPUR 04 अप्रैल 2023 NO TO RTH BILL जीत के लोटेंगे ☎️ : +91 87409-87410 Visit Us 🌐 : https://t.co/BulXsnikr5 #rth #no_rth #RTH #jaipur #hospital #rajasthan https://t.co/AgaBb5LUi1",FALSE
1642887580877221891,"The meeting b/w @betterpakistan and Chinese authorities was aimed at strengthening economic and strategic ties between the two countries. This visit marks a significant milestone in the relationship between China and Pakistan, and sets a promising tone for future collaborations https://t.co/cGYOH4AUI0",TRUE
1642887572455329794,"During Pres Biden's visit to the Cummins Power Generation Facility the Co. will announce it's investing more than $1 billion in its U.S. engine manufacturing network in Indiana, North Carolina and New York to update facilities so they can produce low- to zero-carbon engines. MSN",TRUE
1642887560996216834,@realnikohouse I know that I would keep an account active after MTG sicced all her dumbass followers on me. That is definitely *not* a Pelosi house visit scenario just waiting to happen or anything… Y’all hurt/kill too many people you disagree with &amp; then use others terror of you as proof,FALSE
1642887553140371456,बिना मर्यादा (बंधन) की भक्ति के तो जप-तप अन्य (करनी) क्रियाएँ काल है यानि जीवननाशक है। सच्चा गुरू तो केवल नाम जाप की दीक्षा देता है। #GodNightMonday #SantRampaljiQuotes 📲 अधिक जानकारी के लिए Sant Rampal Ji Maharaj Youtube Channel पर Visit करें | https://t.co/H4mFbp2feN,FALSE
1642887536598040578,@SaintQ92 Coming to visit,FALSE
1642887522274484225,"If you want to see more details, please visit Medium mantleswap https://t.co/LKfaqvwKd4",FALSE
1642887511168155648,The Committee for the Introduction to Islam embraces new converts. https://t.co/v1PZDoTUMb @committee @Islam https://t.co/WZB0HWCYdL,FALSE
1642887509183963136,@IllinoisStateU @ISUSciTech Congratulations @ChadMcEvoy ! I've heard great things about ISU and hope to visit the campus one day,FALSE
1642887502074716160,"Q. Who is Allah? Ans. Allah is Kabir. To know, Download official App or visit our YouTube channel ""Sant Rampal Ji Maharaj"" #True_Allah_Kabir https://t.co/AfKMQxQFUn",FALSE
1642887500778668035,Transform your car into a dream ride with our wide range of genuine accessories. Visit your nearest showroom to know more! #MarutiSuzuki #TrueValue #PreownedCars #Driving #CarAccessories https://t.co/zGy2vsIML1 https://t.co/aRW5p5RPmx,FALSE
1642887489252896769,@far__el I prefer it but large cities are fun to visit. The population of my entire state is less than many cities.,FALSE
1642887483854671875,New Vacancy: Enterprise Officer Closing on: 24 April 2023 To apply visit: https://t.co/uko2bGdvng,FALSE
1642887472123191297,#NowPlaying On #HotxxMagOnlineRadio Ms. Demeanor - Supa Fan Visit: https://t.co/j9qfBFfaAx Submit your music for rotation! Email: HotxxMagOnlineRadio@gmail.com #OnlineRadioStation #Music #Radio #IndieArtistMs. Demeanor https://t.co/oKlXpA0kng,FALSE
1642887469442924548,"@TheNannyTribe Hello, we generally allow users to stand behind what they write. However, if you find a review that you believe violates Yelp's guidelines, we invite you to report it so that our moderators can take a look. For instructions on how to report a review, visit https://t.co/slE23Ai1g4",FALSE
1642887464586035205,"In just over 2 weeks @Versinetic will be exhibiting at the EV #Infrastructure Expo in #Silverstone. Come visit us on Stand B20, in Hall 2 and see a demo of our #EVCharging System. Hope to see you there! #event #EVCharger #EVs #CleanTech https://t.co/odtsaozjLq",FALSE
1642887453630517248,"@JayGrows @real_defender @POTUS No, not concerned at all. How many times did business partners of the previous president's children visit the White House?",FALSE
1642887449033469960,"The OverDrive app will be discontinued. We encourage you to make the switch to Libby, our newer reading app. Libby is made by the same people, with the same goal of connecting you to our library's collection. Download Libby or visit https://t.co/ln9R1iCvw1 to get started. https://t.co/rb0AkDjsEq",FALSE
1642887444356898818,I’m planning a visit in June to see the Juan de Pareja exhibit at the MET. This recent interview with @DrVKV23 nicely contextualizes the exhibit prior to one’s visit. https://t.co/q3hKsaIxMc https://t.co/cWeTnpOfpI,FALSE
1642887437436190722,"Tomorrow, @Pitt_FB will receive a visit from this huge offensive tackle from Ohio. Details in the @frankwalkerlaw Daily Notebook. https://t.co/b8ACDHkoAK https://t.co/SI1mwKNE26",FALSE
1642887433707573248,A Visit to Joshua Tree https://t.co/idi2ylZwGr,FALSE
1642887432382083078,"Special thanks to @Delta - a SaportaReport Platinum level Corporate Sponsor! Our corporate sponsors join us on our mission to provide the most accurate and timely news. For information about sponsorship opportunities with SaportaReport, visit https://t.co/FPatTqWQBo https://t.co/MHgXownDoh",FALSE
1642887430352125958,4. A plug for #coronation resources available for #free via @CofE_EduLead @churchofengland very soon Visit here for more info... https://t.co/oLlrGI5xT9,FALSE
1642887427244150785,Understand how using #effectiveleadmanagementstrategy for capturing promising leads is a crucial point nowadays. Visit the kink mentioned and discover more here. URL: https://t.co/lh4qi0NrsC #managingleads #b2bsales https://t.co/pmq7X0VLQO,FALSE
1642887426069626885,I know about the devil in your bloodstream. I know that the ghosts still visit nightly. I know it must get lonely by the Chesapeake.,FALSE
1642887419077771264,"Q. Who is Allah? Ans. Allah is Kabir. To know, Download official App or visit our YouTube channel ""Sant Rampal Ji Maharaj"" #True_Allah_Kabir #GodMorningMonday https://t.co/sx62QjwDc0",FALSE
1642887410286510081,#GodNightMonday अधिक जानकारी के लिए Sant Rampal Ji Maharaj Youtube Channel visit करें। Watch Sadhna TV at 7:30 pm ! https://t.co/eHyw0lXAJ8,FALSE
1642887407249883137,Hard-wood flooring made easy. Flooring installation. Estimates: (615) 582-6637. Visit us at https://t.co/VLlwKU9Crh #nashville #nashvilletn #nashvillerealtor #nashvillehome #nashvilleconstruction #nashvilletennessee #nashvillegram #nashvillebusiness #nashvillelife #steps https://t.co/CtPOnPqQFj,FALSE
1642887395761586183,"@martneeey @KordyEsq 😂🤣 Craze dey your head. Na only Idia I dey go, didn’t visit Queens.",FALSE
1642887395279241217,@TruBlue20 It’s just crazy how crazy racism was.. to the point you being profiled in your dreams.. shame on her.. we have some what progressed she better be happy u even gave her a dream visit lol,FALSE
1642887392758579200,"Need your own space to study and sit back and relax in on your off days? Check out #SummerCrossing #Apartment Homes in #Huntsville! 📍📚 🔑 We have a 1-bed, 1-bath #available in #April, as well as a 3-bed, 2-bath available in #May. 💻 Visit https://t.co/vTTYObciZ2 for more. https://t.co/NzfXmHFOjh",FALSE
1642887390854250497,"Summer is coming, which means the return of our #Trabzon flights! Visit the Turkish city in its most glorious season. Book now at https://t.co/aUSKlj3wiC https://t.co/Fa2ksrPBEM",FALSE
1642887384617349123,#TrekFest has been ｅｘｔｅｎｄｅｄ!! Savings on bikes and accessories will last until April 30th 🥳 Visit us in-store or online to get incredible deals on great brands like Trek | Electra | &amp; More! https://t.co/2y0CwimsIe #bikesales #bikelife #tuckahoebikeshop https://t.co/ZObb5PZUjJ,FALSE
1642887382667067397,@official_as_s @AstonUniversity @visit_bham @birmingham_live These are all 🔥 bruhhh,FALSE
1642887376589422756,@DavidEmmerson_D @GarrettPopcorn My son that lives in Chicago brings me a big can whenever he comes home to visit. LOVE IT!,FALSE
1642887362479833093,@freckledphleb3 You should visit Illinois..💪🏾,FALSE
1642887360227450890,Brighton Marathon-completed! For free fitness photos (and more!) please visit my page https://t.co/OFDvHLWKQ2 😘 https://t.co/M78cfNbcV4,FALSE
1642887357757116424,It was all hands on deck (literally) at Cedar Grove ✋ Painting wooden hands to create a friendship tree 🎨 Massive thanks to Hayley from Craft Yourself Silly for donating the materials💙 To join a wellbeing centre visit https://t.co/T562bM1tPZ or call 0191 287 7028 https://t.co/SaWhu4VGGS,FALSE
1642887348357586948,"New job opportunity! Inventory Support Specialist III for an assignment in Houston, Texas, to apply and for more information please visit the following link: https://t.co/zoaLWkVIj6 #Inventory #Support #Specialist #Houston #Texas #Job #Jobs #Work #HiringNow #Jobalert #Hiring https://t.co/5DocvIGWPD",FALSE
1642887347632246784,@rishibagree Hope this is not like the surprise visit like PM went to the Mahal,TRUE
1642887346319245312,Water on Mars - Visit https://t.co/x1bMyzQagC #Astronomy #World https://t.co/QoWDHnHEvg,FALSE
1642887336865460224,"Q. Who is Allah? Ans. Allah is Kabir. To know, Download official App or visit our YouTube channel ""Sant Rampal Ji Maharaj"" #True_Allah_Kabir #GodMorningMonday https://t.co/APy8YefQff",FALSE
1642887334256422913,#GodNightMonday अधिक जानकारी के लिए Sant Rampal Ji Maharaj Youtube Channel visit करें। Watch Sadhna TV at 7:30 pm ! https://t.co/DP58eT75yj,FALSE
1642887323183636482,Reply to this tweet and I'll suggest you a country you MUST visit.,FALSE
1642887320117321732,"@KaiseratCB If it's true, it's very funny 😁 I kinda hope he stayed on Elton's compound. Obviously, Cowmilla, WilliLeaks, and Kkkate didn't know Harry was coming. KC3 would have given his Media dogs a heads up &amp; used Harry's visit to promote his unpopular CON-A-NATION👇 https://t.co/0ov0QMTBGN",FALSE
1642887311766552580,"@plusariworld Congratulations!! I was born and raised in London, and I'm sure you'll love it. Also, I suggest you visit Mercedes-Benz world in Weybridge. They got a nice little F1 exhibition with a hanging deconstruction of an F1 car which looks amazing. And they show the races there too.",FALSE
1642887307723194368,Free style libre reader and senso r Adapted&amp;nbsp;to new technology o ..For more info visit...https://t.co/eaysZz2RHi https://t.co/gNA8mYjyPW,FALSE
1642893584398426112,@prageru The constitution,FALSE
1642893542283694080,"When I was still young, before I was a teenager, I wanted to be a superhero. Reading old superhero comics, besides visiting museums, was one of my escapes from gang life. Spider-Man was my favourite- I tried to live by the old quote, ‘with great power comes great responsibility’.",FALSE
1642893523589517312,It's officially April and that means a few more reminders about taxes. Our tax office is assisting with taxes by APPOINTMENT ONLY. You must call 937.237.2976 to schedule. There is NO curbside or walk-in service. You can also E-File by visiting: https://t.co/zh9mT9k5Zk https://t.co/2DWPn4GdGO,FALSE
1642893515884470274,"President Joe Biden is visiting Minnesota on Monday, making a stop in Fridley to tout his economic agenda. https://t.co/z0tlKRfMdL",TRUE
1642893500730470408,"@ArabellaRober19 Probably, and made sure he dodged any medicals by ‘visiting Granny’",FALSE
1642893493726216193,"@IndiaPostOffice @rsprasad Seriously frustrated with Indian Post. My pkg was supposed to arrive days ago and still no sign of it. I have followed up multiple times visiting the post office. They mentioned the pkg is out for delivery. Now it is showing ""address cannot be located""",FALSE
1642893467612225537,@TWilliamson55 Is tim visiting ?,FALSE
1642893465997438981,Visiting my aunt on the neighbouring farm. I have to be careful of the dogs as they almost bit me yesterday. https://t.co/zBgFCCiCXW,FALSE
1642893455939469312,Thanks to @BBCLondonNews for highlighting this issue and visiting @AgeUKWandsworth to get views from older Londoners. 25% of Londoners over 50 are in living in poverty. https://t.co/1UiUFv5GqZ #politicslondon | @JessicaMCUre,FALSE
1642893413597978628,Check out our latest predicted papers for GCSE and A-levels (AQA and Edexcel)! Gain an edge on your exams by visiting us at https://t.co/EccNsJOmub. #predictedpapers #maths2023 #alevels #alevel #gcse #alevelmaths #gcsemaths #mathsrevision #mathsexams https://t.co/zSViWidGoO,FALSE
1642893388650348547,"@scarlett102341 Well my family wasn't hardcore RSS either. I saw my father having friends &amp; relatives in both Congress and the BJP. We regularly saw Mr. KC Pant, George fernandes, Dr. Murli Manohar Joshi and many other secretaries and PA's visiting our home. He was a supporter of the BJP but…",FALSE
1642893371424542720,"@cheygoulet I have identical twin daughters, age 19. They are sophomores in college, visiting on Spring Break. Hence the soft tacos!",FALSE
1642893275941212162,@Helium_09 visiting ki vellava admit avvadaniki vellava https://t.co/qTrPjNvFCd,FALSE
1642893187415982080,@onerachaelo Yes it’s kind of invasive definitely. I’ve yet to see bees visiting the flowers. There are so few pollinators this year it’s really disappointing.,FALSE
1642893096244609025,Visiting Seattle in a few weeks https://t.co/pJKQKoqnzq #seattle,FALSE
1642893093249613829,"@RamenOvercooked @LyrisArt @khyleri I'm not gonna call you slurs man. Pls read. The work was shock work, ok, but. Anya was just visiting present day camp. Also the horror undertones only makes us grow empathy for actual victims. Finally, art is but a drawing. And this is not a nazi flag. It has a wider context. Ty",FALSE
1642893083850207234,Received a notification on a post that 14 yrs ago Herb King passed away. I was just telling a story about him last night! Maybe he was visiting me?,FALSE
1642893053789708288,⁦@jordanbpeterson⁩ - Was visiting the Basilica di Santa Maria Maggiore in Rome a few hours ago and this caught my eye: https://t.co/e6NyP6xzPD,FALSE
1642892984394866689,Visiting and harvesting #vegetables at the #rooftopgarden #gardenersjoy #harvest ... #VegetableGardening https://t.co/WNibf0VR7v https://t.co/9NkjewYDwZ,FALSE
1642892961884291072,Had a fantastic time visiting @Cardamom County Resort in #Thekkady and the Xandari Resorts (A unit of The Muthoot Group) Pearl resort in #Mararikulam. Enjoyed some wonderful #conversations with our team. #teamwork #experience https://t.co/XJMZg6BtJc,FALSE
1642892921140568068,@_corimii Maybe developers were trying to avoid spoilers of previous R&amp;C games for new audience who met the franchise through Rift apart. That's why we didn't get a proper explanation in RA why Ratchet was so anxious and uncertain about visiting the lombax dimension.,FALSE
1642892911607173120,"It seemed incorrect that Adam visiting would have made his loneliness worse, but he missed him acutely even as he was looking at him.",FALSE
1642892877373030403,@robreiner Odd how those who seem above everybody else like Mr. Reiner can go ahead and criticize others yet he won’t admit his own feelings like visiting Epstein’s island,FALSE
1642892876253208576,"@m_a_k_tweets @EPropoganda1 @AJCongress State cannot control everyone, especially with foreign passports. Many Pakistanis have double passports. They are only stopped from visiting Israel on Pakistani passports. Israel also allows Pakistanis entry without passport by stamping a plain paper.",TRUE
1642892851045384198,visiting texas in exactly one month https://t.co/d9IwSl0v2u,FALSE
1642892838617620481,"We enjoyed visiting a family who has ten children (ranging from 2 to 21 years old), including a daughter (on my right in photo 4) who was converted as a child through reading one of the stories in ""Building on the Rock,"" by Diana Kleyn and me. How humbling such testimonies are!",FALSE
1642892823321260033,@FightHaven I'm never visiting America 💀 wtf is it that easy?,FALSE
1642892822348013568,"@kevinandthesims I find there's lots to do there, with the nightclub, cafe, bluffs and swimming pool. My sims usually end up visiting Windenburg when they want to go out",FALSE
1642892821664526337,@MrBlackOG Siku ya visiting masaake akakuja chuo anataka kujuwa mbona mtoto wake anashindwa kuperform kwa class kumbe ni mimi napea mtoto wa wenywe mapenzi moto moto,FALSE
1642892738688368642,"@Ca53yFr0st It'll be a good way to enjoy life after college. While visiting, I can look for work.",FALSE
1642892718706663424,"@KatyaTaylor @ProfMHWhitworth When are you there, Catherine? I’m visiting on Wednesday for an interview.",FALSE
1642892618198835201,It was wonderful visiting IIM Indore🙂 https://t.co/ipVzbY3fEa #IIT #iim #cat #MBA #jee #Indore https://t.co/3BaB9gzuFF,FALSE
1642892585705299971,We are excited to begin our week in Estes Park at the Colorado Risk Reduction Network Conference of the Rockies! We look forward to visiting with our partners and meeting new Fire Departments! #thecomplianceengine #CRR #fireprevention #publicsafety #SaaS #brycer https://t.co/yN3GtMPB4n,FALSE
1642892556131504129,"➡️Flagging off at a grand Opening Ceremony onboard SLNS Vijayabahu in presence of Deputy HC @VinodKJacob76 and Chief of Staff,#SriLanka Navy. ➡️Call on Commander Western Naval Area by Commanding Officers of the visiting ships. ➡️ Respects to the martyrs,at the IPKF Memorial.2/ https://t.co/C757wdTRHq",FALSE
1642892549135147013,"After the conference was over on Saturday, we enjoyed visiting with brother Jeff who had an excellent display of old Bibles at the conference (see https://t.co/Wmw7pOquzr), which included one of three copies in the world of Luther's Last Will and Testament (photo 2).",FALSE
1642892545309962241,"We have had a great day visiting the lab where Alexander Fleming discovered the contaminant that gave us penicillin! 🧫🍄 Thanks to @KBrownHistorian for giving us a great, informative tour! https://t.co/YFFxs7F4jw",FALSE
1642892476536041474,"#habeck #Ukraine #Germany Robert Habeck, German minister for economic affairs, is visiting Kyiv for talks about the reconstruction of the country. Nice gesture, but I doubt Ukraine can help much reconstructing Germany after his reign.",TRUE
1642892466956189697,@JeremyClarkson Got back to the US after holidaying &amp; visiting Diddly Squat! Loved it! Dunno if you still have sheep-but you could make a killing from crafters if you sold yarn @ shop. I paid 10L for 100g pure wool yarn. And local UK wool is even higher. Call it O My Knitty Aunt.,FALSE
1642892455652499463,"@TheDuckMachine Hi Jason, Thanks for sharing your story regarding the cheese. We are however sorry to hear that you had to queue for 45 minutes when visiting one of our branches, Please accept our sincerest apologies for any inconvenience this had caused. Best Wishes Well Pharmacy",FALSE
1642892451332358144,Visiting places https://t.co/yBUgS7jFO1,FALSE
1642892440515276803,"@MatthewHappold It is irksome -- visiting professorships are limited-term things, so far as I know. If it's going in your profile, it should explicitly say what years. If you are an ongoing part-time lecturer, that's a different thing.",FALSE
1642892426254729218,@paulinka_don Same as with people from any democracy visiting the PRC or post-putsch John Lee-era Hong Kong.,TRUE
1642892336274321415,National Survey Reveals 60% of U.S. TikTok Users Have Become Interested in Visiting a New Travel Destination After Seeing it on TikTok https://t.co/Fz4HajTwGE @MGHus #martech #marketing #Technology #TikTok #MGH,FALSE
1642892329177546758,"Now Hiring: Visiting Assistant Professor of Korean Language and Culture | Wesleyan University: Middletown, Connecticut | https://t.co/Rv3uzXpYZ0 #jobs",FALSE
1642892319354683398,@ErickaWaller1 Are you going visiting Enzo?💕🌷🌷🐾🐾,FALSE
1642892295463731206,"""I can add only one thing after seeing all this. I wish Russian President Putin to spend the rest of his days in a basement with a bucket instead of a toilet"", - President Zelensky said after visiting a place where Russians were holding people. Screenshot: Suspilne media 🎥 https://t.co/xfq8r7vuqz",TRUE
1642892291751948288,"we living in north melbourne or around carlton, spend weekend out of the city and going hiking or visiting vineyard together ✨ https://t.co/baBtr4GMiZ",FALSE
1642892287788105735,"@rosemcgowan what a pleasure to have met you, you are a very elegant and pleasant woman. I'm ready to give you French lessons, your accent is charming. Ah ah 😀thank you for visiting France #Ladyrose https://t.co/4bMzLRWwjJ",FALSE
1642892260021878784,i’m visiting family and i’ve just found my old tenth doctor tardis https://t.co/g5fLHVxhdh,FALSE
1642892244326727682,"We started the camp by children in #eco_clubs visiting @SavingGorillas to learn&amp; understand more about #Gorillas,nature &amp; people like Dian Fossey who advocated/faught for Gorillas protection. https://t.co/Gy1m9p4nGY",FALSE
1642892238630838272,United night when you have legends in the house ⁦@ManUtd⁩ when are you visiting Dubai again please please come soon https://t.co/jhWwwLAfcs,FALSE
1642892237976526849,@AprilWorld @temiokomi I thought you have knowledge of politics and government...You never have any doubt why would KEYAMO tweet a fake passport of Tinubu. The only evidence here was his visiting Obama campaign rally...Like nothing else after that.,TRUE
1642892232045805571,"@hiragananinja If it's in accordance with the law, especially being in someone else's country where I trust that their policemen are truthful &amp; perform their job honorably, I would consent to them checking. No problem. This is interesting. Never happened to my sister and I when visiting.",FALSE
1642892215004327941,"We are accepting applications for our 2023 Summer Internship program! Visiting student alumni have published their work at top venues, won best paper awards, and earned recognition by the CRA for outstanding undergraduate research. Learn more and apply: https://t.co/iam5REb4lX https://t.co/gO5rjJ79C6",FALSE
